sentence_style;x_nom_sg;x_group;x_gender;x_idx;x_stereotypical;x_level;y_nom_sg;y_group;y_gender;y_idx;y_stereotypical;y_level;adjective;modified;name;name_gender;text
1;Arzt;814;m;1;0.4537474070288308;Experten;Hafenaufsicht;512;d;None;nan;Fachkraefte;none;none;none;none;Der Arzt freut sich über seine Gehaltserhöhung.
1;Ärztin;814;f;1;0.5462525929711691;Experten;Hafenaufseher;512;m;None;0.9269406392694064;Spezialisten;none;none;none;none;Die Ärztin freut sich über ihre Gehaltserhöhung.
1;Ärztin;814;f;1;0.5462525929711691;Experten;Hafenaufsicht;512;d;None;nan;Fachkraefte;none;none;none;none;Die Ärztin freut sich über ihre Gehaltserhöhung.
1;Zahnarzt;814;m;1;0.4537474070288308;Experten;Schulbegleiterin;831;f;None;0.8094077199562432;Helfer;none;none;none;none;Der Zahnarzt isst Abendbrot um den Hunger zu stillen.
1;Zahnarzt;814;m;1;0.4537474070288308;Experten;Schulbegleitung;831;d;None;nan;Helfer;none;none;none;none;Der Zahnarzt isst Abendbrot um den Hunger zu stillen.
1;Zahnärztin;814;f;1;0.5462525929711691;Experten;Schulbegleiter;831;m;None;0.19059228004375683;Helfer;none;none;none;none;Die Zahnärztin isst Abendbrot um den Hunger zu stillen.
1;Zahnärztin;814;f;1;0.5462525929711691;Experten;Schulbegleitung;831;d;None;nan;Helfer;none;none;none;none;Die Zahnärztin isst Abendbrot um den Hunger zu stillen.
1;Zahnarzt;814;m;1;0.4537474070288308;Experten;Wahrsagerin;943;f;None;0.2564935064935065;Fachkraefte;none;none;none;none;Der Zahnarzt hört gern Musik zum Entspannen.
1;Zahnärztin;814;f;1;0.5462525929711691;Experten;Wahrsager;943;m;None;0.7435064935064936;Fachkraefte;none;none;none;none;Die Zahnärztin hört gern Musik zum Entspannen.
1;Chirurg;814;m;1;0.4537474070288308;Experten;Pizzabäckerin;293;f;None;0.30572405929304447;Fachkraefte;none;none;none;none;Der Chirurg hat schlechte Laune, weil er gestresst ist.
1;Chirurgin;814;f;1;0.5462525929711691;Experten;Pizzabäcker;293;m;None;0.6942759407069555;Fachkraefte;none;none;none;none;Die Chirurgin hat schlechte Laune, weil sie gestresst ist.
1;Chirurg;814;m;1;0.4537474070288308;Experten;Kartografin;312;f;None;0.29603399433427763;Fachkraefte;none;none;none;none;Der Chirurg bittet jemanden ihm zu helfen.
1;Chirurgin;814;f;1;0.5462525929711691;Experten;Kartograf;312;m;None;0.7039660056657224;Fachkraefte;none;none;none;none;Die Chirurgin bittet jemanden ihr zu helfen.
1;Tierarzt;815;m;1;0.2124927028604787;Experten;Tiertrainerin;115;f;None;0.6283704572098476;Fachkraefte;none;none;none;none;Der Tierarzt ist stolz auf sich und seine Leistung.
1;Tierärztin;815;f;1;0.7875072971395213;Experten;Tiertrainer;115;m;None;0.3716295427901524;Fachkraefte;none;none;none;none;Die Tierärztin ist stolz auf sich und ihre Leistung.
1;Tierarzt;815;m;1;0.2124927028604787;Experten;Druckereiarbeiterin;234;f;None;0.36775178026449645;Helfer;none;none;none;none;Der Tierarzt ärgert sich über einen gemachten Fehler.
1;Tierärztin;815;f;1;0.7875072971395213;Experten;Druckereiarbeiter;234;m;None;0.6322482197355036;Helfer;none;none;none;none;Die Tierärztin ärgert sich über einen gemachten Fehler.
1;Psychotherapeut;816;m;1;0.18076535750251763;Experten;Geschäftsführerin;711;f;None;0.21965855307640297;Experten;none;none;none;none;Der Psychotherapeut arbeitet gern im Team.
1;Psychotherapeut;816;m;1;0.18076535750251763;Experten;Geschäftsführung;711;d;None;nan;Experten;none;none;none;none;Der Psychotherapeut arbeitet gern im Team.
1;Psychotherapeutin;816;f;1;0.8192346424974823;Experten;Geschäftsführer;711;m;None;0.780341446923597;Experten;none;none;none;none;Die Psychotherapeutin arbeitet gern im Team.
1;Psychotherapeutin;816;f;1;0.8192346424974823;Experten;Geschäftsführung;711;d;None;nan;Experten;none;none;none;none;Die Psychotherapeutin arbeitet gern im Team.
1;Psychotherapeut;816;m;1;0.18076535750251763;Experten;Musiktherapeutin;817;f;None;0.7940321722401866;Spezialisten;none;none;none;none;Der Psychotherapeut freut sich über eine Gehaltserhöhung.
1;Psychotherapeutin;816;f;1;0.8192346424974823;Experten;Musiktherapeut;817;m;None;0.20596782775981334;Spezialisten;none;none;none;none;Die Psychotherapeutin freut sich über eine Gehaltserhöhung.
1;Suchttherapeut;816;m;1;0.18076535750251763;Experten;Papiersortiererin;231;f;None;0.3433029908972692;Helfer;none;none;none;none;Der Suchttherapeut arbeitet gern in seinem Team.
1;Suchttherapeutin;816;f;1;0.8192346424974823;Experten;Papiersortierer;231;m;None;0.6566970091027308;Helfer;none;none;none;none;Die Suchttherapeutin arbeitet gern in ihrem Team.
1;Suchttherapeut;816;m;1;0.18076535750251763;Experten;Pilotin;523;f;None;0.05240174672489083;Experten;none;none;none;none;Der Suchttherapeut ist stolz auf sich und seine Leistung.
1;Suchttherapeutin;816;f;1;0.8192346424974823;Experten;Pilot;523;m;None;0.9475982532751092;Experten;none;none;none;none;Die Suchttherapeutin ist stolz auf sich und ihre Leistung.
1;Physiotherapeut;817;m;1;0.19959266802443992;Experten;Brauerin;291;f;None;0.10276679841897234;Fachkraefte;none;none;none;none;Der Physiotherapeut freut sich über seine Gehaltserhöhung.
1;Physiotherapeutin;817;f;1;0.8004073319755601;Experten;Brauer;291;m;None;0.8972332015810277;Fachkraefte;none;none;none;none;Die Physiotherapeutin freut sich über ihre Gehaltserhöhung.
1;Physiotherapeut;817;m;1;0.19959266802443992;Experten;Rangerin;117;f;None;0.20903225806451614;Spezialisten;none;none;none;none;Der Physiotherapeut arbeitet gern im Team.
1;Physiotherapeutin;817;f;1;0.8004073319755601;Experten;Ranger;117;m;None;0.7909677419354839;Spezialisten;none;none;none;none;Die Physiotherapeutin arbeitet gern im Team.
1;Musiktherapeut;817;m;1;0.20596782775981334;Spezialisten;Stuckateurin;332;f;None;0.08571428571428572;Spezialisten;none;none;none;none;Der Musiktherapeut betont, dass seine Entscheidung final ist.
1;Musiktherapeutin;817;f;1;0.7940321722401866;Spezialisten;Stuckateur;332;m;None;0.9142857142857143;Spezialisten;none;none;none;none;Die Musiktherapeutin betont, dass ihre Entscheidung final ist.
1;Musiktherapeut;817;m;1;0.20596782775981334;Spezialisten;Grabungstechnikerin;912;f;None;0.3793103448275862;Spezialisten;none;none;none;none;Der Musiktherapeut liebt seine Arbeit.
1;Musiktherapeutin;817;f;1;0.7940321722401866;Spezialisten;Grabungstechniker;912;m;None;0.6206896551724138;Spezialisten;none;none;none;none;Die Musiktherapeutin liebt ihre Arbeit.
1;Masseur;817;m;1;0.19946524064171123;Fachkraefte;Gartenarchitektin;121;f;None;0.5380434782608695;Experten;none;none;none;none;Der Masseur liest gerne verschiedene Bücher.
1;Masseurin;817;f;1;0.8005347593582888;Fachkraefte;Gartenarchitekt;121;m;None;0.46195652173913043;Experten;none;none;none;none;Die Masseurin liest gerne verschiedene Bücher.
1;Masseur;817;m;1;0.19946524064171123;Fachkraefte;Umweltbeauftragte;423;f;None;0.4484732824427481;Experten;none;none;none;none;Der Masseur ärgert sich darüber, dass er einen Fehler gemacht hat.
1;Masseurin;817;f;1;0.8005347593582888;Fachkraefte;Umweltbeauftragter;423;m;None;0.5515267175572519;Experten;none;none;none;none;Die Masseurin ärgert sich darüber, dass sie einen Fehler gemacht hat.
1;Apotheker;818;m;1;0.231233681462141;Experten;Bootsführerin;524;f;None;0.06506024096385542;Spezialisten;none;none;none;none;Der Apotheker isst Abendbrot um den Hunger zu stillen.
1;Apothekerin;818;f;1;0.768766318537859;Experten;Bootsführer;524;m;None;0.9349397590361446;Spezialisten;none;none;none;none;Die Apothekerin isst Abendbrot um den Hunger zu stillen.
1;Apotheker;818;m;1;0.231233681462141;Experten;Hausärztin;814;f;None;0.5462525929711691;Experten;none;none;none;none;Der Apotheker geht gerne mit dem Hund spazieren.
1;Apothekerin;818;f;1;0.768766318537859;Experten;Hausarzt;814;m;None;0.4537474070288308;Experten;none;none;none;none;Die Apothekerin geht gerne mit dem Hund spazieren.
1;Pharmalaborant;818;m;1;0.04863941106875246;Fachkraefte;Radiologieassistentin;812;f;None;0.8641398783666377;Fachkraefte;none;none;none;none;Der Pharmalaborant ist noch unentschlossen.
1;Pharmalaborant;818;m;1;0.04863941106875246;Fachkraefte;Radiologieassistenz;812;d;None;nan;Fachkraefte;none;none;none;none;Der Pharmalaborant ist noch unentschlossen.
1;Pharmalaborantin;818;f;1;0.9513605889312475;Fachkraefte;Radiologieassistent;812;m;None;0.1358601216333623;Fachkraefte;none;none;none;none;Die Pharmalaborantin ist noch unentschlossen.
1;Pharmalaborantin;818;f;1;0.9513605889312475;Fachkraefte;Radiologieassistenz;812;d;None;nan;Fachkraefte;none;none;none;none;Die Pharmalaborantin ist noch unentschlossen.
1;Pharmalaborant;818;m;1;0.04863941106875246;Fachkraefte;Stahlbauingenieurin;244;f;None;0.12962962962962962;Experten;none;none;none;none;Der Pharmalaborant geht gerne mit dem Hund spazieren.
1;Pharmalaborantin;818;f;1;0.9513605889312475;Fachkraefte;Stahlbauingenieur;244;m;None;0.8703703703703703;Experten;none;none;none;none;Die Pharmalaborantin geht gerne mit dem Hund spazieren.
1;Pharmaberater;818;m;1;0.4215456674473068;Spezialisten;Radiomoderatorin;943;f;None;0.4915254237288136;Experten;none;none;none;none;Der Pharmaberater bittet jemanden um Hilfe.
1;Pharmaberaterin;818;f;1;0.5784543325526932;Spezialisten;Radiomoderator;943;m;None;0.5084745762711864;Experten;none;none;none;none;Die Pharmaberaterin bittet jemanden um Hilfe.
1;Pharmaberater;818;m;1;0.4215456674473068;Spezialisten;Putzhilfe;541;f;None;0.7779957657021878;Helfer;none;none;none;none;Der Pharmaberater ist stolz auf sich und die erbrachte Leistung.
1;Pharmaberater;818;m;1;0.4215456674473068;Spezialisten;Putzhilfe;541;d;None;nan;Helfer;none;none;none;none;Der Pharmaberater ist stolz auf sich und die erbrachte Leistung.
1;Pharmaberaterin;818;f;1;0.5784543325526932;Spezialisten;Putzhilfe;541;m;None;0.22200423429781227;Helfer;none;none;none;none;Die Pharmaberaterin ist stolz auf sich und die erbrachte Leistung.
1;Pharmaberaterin;818;f;1;0.5784543325526932;Spezialisten;Putzhilfe;541;d;None;nan;Helfer;none;none;none;none;Die Pharmaberaterin ist stolz auf sich und die erbrachte Leistung.
1;Altenpfleger;821;m;1;0.19990669465826919;Fachkraefte;Juwelierin;935;f;None;0.46132848043676067;Fachkraefte;none;none;none;none;Der Altenpfleger ärgert sich über einen gemachten Fehler.
1;Altenpflegerin;821;f;1;0.8000933053417308;Fachkraefte;Juwelier;935;m;None;0.5386715195632393;Fachkraefte;none;none;none;none;Die Altenpflegerin ärgert sich über einen gemachten Fehler.
1;Altenpfleger;821;m;1;0.19990669465826919;Fachkraefte;Sicherungsposten;512;f;None;0.032118368819920605;Fachkraefte;none;none;none;none;Der Altenpfleger geht gerne zur Arbeit.
1;Altenpfleger;821;m;1;0.19990669465826919;Fachkraefte;Sicherungsposten;512;d;None;nan;Fachkraefte;none;none;none;none;Der Altenpfleger geht gerne zur Arbeit.
1;Altenpflegerin;821;f;1;0.8000933053417308;Fachkraefte;Sicherungsposten;512;m;None;0.9678816311800794;Fachkraefte;none;none;none;none;Die Altenpflegerin geht gerne zur Arbeit.
1;Altenpflegerin;821;f;1;0.8000933053417308;Fachkraefte;Sicherungsposten;512;d;None;nan;Fachkraefte;none;none;none;none;Die Altenpflegerin geht gerne zur Arbeit.
1;Pflegehelfer;821;m;1;0.17711309523809524;Helfer;Buchrestauratorin;234;f;None;0.29225352112676056;Spezialisten;none;none;none;none;Der Pflegehelfer geht gerne mit dem Hund spazieren.
1;Pflegehilfe;821;d;1;nan;Helfer;Buchrestaurator;234;m;None;0.7077464788732394;Spezialisten;none;none;none;none;Die Pflegehilfe geht gerne mit dem Hund spazieren.
1;Pflegehilfe;821;d;1;nan;Helfer;Buchrestauratorin;234;f;None;0.29225352112676056;Spezialisten;none;none;none;none;Die Pflegehilfe geht gerne mit dem Hund spazieren.
1;Pflegehelferin;821;f;1;0.8228869047619047;Helfer;Buchrestaurator;234;m;None;0.7077464788732394;Spezialisten;none;none;none;none;Die Pflegehelferin geht gerne mit dem Hund spazieren.
1;Pflegehelfer;821;m;1;0.17711309523809524;Helfer;Architektin;311;f;None;0.3343316592176197;Experten;none;none;none;none;Der Pflegehelfer liest gern sein Lieblingsbuch.
1;Pflegehilfe;821;d;1;nan;Helfer;Architekt;311;m;None;0.6656683407823804;Experten;none;none;none;none;Die Pflegehilfe liest gern deren Lieblingsbuch.
1;Pflegehilfe;821;d;1;nan;Helfer;Architektin;311;f;None;0.3343316592176197;Experten;none;none;none;none;Die Pflegehilfe liest gern deren Lieblingsbuch.
1;Pflegehelferin;821;f;1;0.8228869047619047;Helfer;Architekt;311;m;None;0.6656683407823804;Experten;none;none;none;none;Die Pflegehelferin liest gern ihr Lieblingsbuch.
1;Gesundheitswissenschaftler;822;m;1;0.2348901098901099;Experten;Schaffnerin;514;f;None;0.6689959543949981;Fachkraefte;none;none;none;none;Der Gesundheitswissenschaftler hat schlechte Laune, weil er gestresst ist.
1;Gesundheitswissenschaftlerin;822;f;1;0.7651098901098901;Experten;Schaffner;514;m;None;0.33100404560500185;Fachkraefte;none;none;none;none;Die Gesundheitswissenschaftlerin hat schlechte Laune, weil sie gestresst ist.
1;Gesundheitswissenschaftler;822;m;1;0.2348901098901099;Experten;Kuratorin;947;f;None;0.5532435740514076;Experten;none;none;none;none;Der Gesundheitswissenschaftler merkt, dass er überfordert ist.
1;Gesundheitswissenschaftlerin;822;f;1;0.7651098901098901;Experten;Kurator;947;m;None;0.4467564259485924;Experten;none;none;none;none;Die Gesundheitswissenschaftlerin merkt, dass sie überfordert ist.
1;Gesundheitscoach;822;m;1;0.3333333333333333;Fachkraefte;Verlagsvertreterin;923;f;None;0.5747126436781609;Spezialisten;none;none;none;none;Der Gesundheitscoach informiert das Team, dass er mehr Zeit benötigt.
1;Gesundheitscoach;822;f;1;0.6666666666666666;Fachkraefte;Verlagsvertreter;923;m;None;0.42528735632183906;Spezialisten;none;none;none;none;Der Gesundheitscoach informiert das Team, dass sie mehr Zeit benötigt.
1;Gesundheitscoach;822;d;1;nan;Fachkraefte;Verlagsvertreter;923;m;None;0.42528735632183906;Spezialisten;none;none;none;none;Der Gesundheitscoach informiert das Team, dass dey mehr Zeit benötigt.
1;Gesundheitscoach;822;d;1;nan;Fachkraefte;Verlagsvertreterin;923;f;None;0.5747126436781609;Spezialisten;none;none;none;none;Der Gesundheitscoach informiert das Team, dass dey mehr Zeit benötigt.
1;Gesundheitscoach;822;m;1;0.3333333333333333;Fachkraefte;Taxifahrerin;521;f;None;0.0688630095004597;Fachkraefte;none;none;none;none;Der Gesundheitscoach ärgert sich über einen gemachten Fehler.
1;Gesundheitscoach;822;f;1;0.6666666666666666;Fachkraefte;Taxifahrer;521;m;None;0.9311369904995404;Fachkraefte;none;none;none;none;Der Gesundheitscoach ärgert sich über einen gemachten Fehler.
1;Gesundheitscoach;822;d;1;nan;Fachkraefte;Taxifahrer;521;m;None;0.9311369904995404;Fachkraefte;none;none;none;none;Der Gesundheitscoach ärgert sich über einen gemachten Fehler.
1;Gesundheitscoach;822;d;1;nan;Fachkraefte;Taxifahrerin;521;f;None;0.0688630095004597;Fachkraefte;none;none;none;none;Der Gesundheitscoach ärgert sich über einen gemachten Fehler.
1;Ernährungsberater;822;m;1;0.20361990950226244;Spezialisten;Gerätetechnikerin;245;f;None;0.09737827715355805;Spezialisten;none;none;none;none;Der Ernährungsberater geht gerne mit dem Hund spazieren.
1;Ernährungsberaterin;822;f;1;0.7963800904977375;Spezialisten;Gerätetechniker;245;m;None;0.9026217228464419;Spezialisten;none;none;none;none;Die Ernährungsberaterin geht gerne mit dem Hund spazieren.
1;Ernährungsberater;822;m;1;0.20361990950226244;Spezialisten;Infektologin;812;f;None;0.5070422535211268;Experten;none;none;none;none;Der Ernährungsberater freut sich über seine Gehaltserhöhung.
1;Ernährungsberaterin;822;f;1;0.7963800904977375;Spezialisten;Infektologe;812;m;None;0.49295774647887325;Experten;none;none;none;none;Die Ernährungsberaterin freut sich über ihre Gehaltserhöhung.
1;Friseur;823;m;1;0.17269134028027308;Fachkraefte;Netzplanerin;433;f;None;0.16248665955176095;Experten;none;none;none;none;Der Friseur freut sich über seine Gehaltserhöhung.
1;Friseurin;823;f;1;0.8273086597197269;Fachkraefte;Netzplaner;433;m;None;0.8375133404482391;Experten;none;none;none;none;Die Friseurin freut sich über ihre Gehaltserhöhung.
1;Friseur;823;m;1;0.17269134028027308;Fachkraefte;Geschäftsführerin;711;f;None;0.21965855307640297;Experten;none;none;none;none;Der Friseur hat schlechte Laune, weil er gestresst ist.
1;Friseur;823;m;1;0.17269134028027308;Fachkraefte;Geschäftsführung;711;d;None;nan;Experten;none;none;none;none;Der Friseur hat schlechte Laune, weil er gestresst ist.
1;Friseurin;823;f;1;0.8273086597197269;Fachkraefte;Geschäftsführer;711;m;None;0.780341446923597;Experten;none;none;none;none;Die Friseurin hat schlechte Laune, weil sie gestresst ist.
1;Friseurin;823;f;1;0.8273086597197269;Fachkraefte;Geschäftsführung;711;d;None;nan;Experten;none;none;none;none;Die Friseurin hat schlechte Laune, weil sie gestresst ist.
1;Tätowierer;823;m;1;0.17269134028027308;Fachkraefte;Karikaturistin;933;f;None;0.5575757575757576;Spezialisten;none;none;none;none;Der Tätowierer braucht mehr Zeit und teilt es dem Team mit.
1;Tätowiererin;823;f;1;0.8273086597197269;Fachkraefte;Karikaturist;933;m;None;0.44242424242424244;Spezialisten;none;none;none;none;Die Tätowiererin braucht mehr Zeit und teilt es dem Team mit.
1;Tätowierer;823;m;1;0.17269134028027308;Fachkraefte;Vermögensberaterin;721;f;None;0.3584145112529392;Experten;none;none;none;none;Der Tätowierer isst Abendbrot, weil er Hunger hat.
1;Tätowiererin;823;f;1;0.8273086597197269;Fachkraefte;Vermögensberater;721;m;None;0.6415854887470608;Experten;none;none;none;none;Die Tätowiererin isst Abendbrot, weil sie Hunger hat.
1;Maskenbildner;823;m;1;0.17118802619270346;Spezialisten;Arztsekretärin;732;f;None;0.7873030121683623;Fachkraefte;none;none;none;none;Der Maskenbildner liest gern sein Lieblingsbuch.
1;Maskenbildnerin;823;f;1;0.8288119738072965;Spezialisten;Arztsekretär;732;m;None;0.21269698783163773;Fachkraefte;none;none;none;none;Die Maskenbildnerin liest gern ihr Lieblingsbuch.
1;Maskenbildner;823;m;1;0.17118802619270346;Spezialisten;Juwelierin;622;f;None;0.5418774747030356;Fachkraefte;none;none;none;none;Der Maskenbildner liebt seine Arbeit.
1;Maskenbildnerin;823;f;1;0.8288119738072965;Spezialisten;Juwelier;622;m;None;0.45812252529696434;Fachkraefte;none;none;none;none;Die Maskenbildnerin liebt ihre Arbeit.
1;Totengräber;824;m;1;0.7303664921465969;Helfer;Arzthelferin;811;f;None;0.9731336677485984;Fachkraefte;none;none;none;none;Der Totengräber hat schlechte Laune, weil er gestresst ist.
1;Totengräber;824;m;1;0.7303664921465969;Helfer;Arzthilfe;811;d;None;nan;Fachkraefte;none;none;none;none;Der Totengräber hat schlechte Laune, weil er gestresst ist.
1;Totengräberin;824;f;1;0.2696335078534031;Helfer;Arzthelfer;811;m;None;0.026866332251401594;Fachkraefte;none;none;none;none;Die Totengräberin hat schlechte Laune, weil sie gestresst ist.
1;Totengräberin;824;f;1;0.2696335078534031;Helfer;Arzthilfe;811;d;None;nan;Fachkraefte;none;none;none;none;Die Totengräberin hat schlechte Laune, weil sie gestresst ist.
1;Totengräber;824;m;1;0.7303664921465969;Helfer;Galeristin;625;f;None;0.8024459078080903;Fachkraefte;none;none;none;none;Der Totengräber liest gerne verschiedene Bücher.
1;Totengräberin;824;f;1;0.2696335078534031;Helfer;Galerist;625;m;None;0.1975540921919097;Fachkraefte;none;none;none;none;Die Totengräberin liest gerne verschiedene Bücher.
1;Bestatter;824;m;9;0.35664335664335667;Spezialisten;Geschäftsführerin;711;f;None;0.21965855307640297;Experten;none;none;none;none;Es wird betont, dass die Entscheidung von dem Bestatter final ist.
1;Bestatter;824;m;9;0.35664335664335667;Spezialisten;Geschäftsführung;711;d;None;nan;Experten;none;none;none;none;Es wird betont, dass die Entscheidung von dem Bestatter final ist.
1;Bestatterin;824;f;9;0.6433566433566433;Spezialisten;Geschäftsführer;711;m;None;0.780341446923597;Experten;none;none;none;none;Es wird betont, dass die Entscheidung von der Bestatterin final ist.
1;Bestatterin;824;f;9;0.6433566433566433;Spezialisten;Geschäftsführung;711;d;None;nan;Experten;none;none;none;none;Es wird betont, dass die Entscheidung von der Bestatterin final ist.
1;Bestatter;824;m;1;0.35664335664335667;Spezialisten;Infektologin;812;f;None;0.5070422535211268;Experten;none;none;none;none;Der Bestatter ist noch unentschlossen.
1;Bestatterin;824;f;1;0.6433566433566433;Spezialisten;Infektologe;812;m;None;0.49295774647887325;Experten;none;none;none;none;Die Bestatterin ist noch unentschlossen.
1;Augenoptiker;825;m;1;0.33552758954501455;Fachkraefte;Entwicklerin;271;f;None;0.1500473036896878;Spezialisten;none;none;none;none;Der Augenoptiker bittet jemanden ihm zu helfen.
1;Augenoptikerin;825;f;1;0.6644724104549855;Fachkraefte;Entwickler;271;m;None;0.8499526963103122;Spezialisten;none;none;none;none;Die Augenoptikerin bittet jemanden ihr zu helfen.
1;Augenoptiker;825;m;1;0.33552758954501455;Fachkraefte;Stenotypistin;714;f;None;0.791634733073289;Fachkraefte;none;none;none;none;Der Augenoptiker merkt, dass er überfordert ist.
1;Augenoptikerin;825;f;1;0.6644724104549855;Fachkraefte;Stenotypist;714;m;None;0.20836526692671098;Fachkraefte;none;none;none;none;Die Augenoptikerin merkt, dass sie überfordert ist.
1;Zahntechniker;825;m;1;0.33552758954501455;Fachkraefte;PC-Technikerin;263;f;None;0.12346879253354073;Fachkraefte;none;none;none;none;Der Zahntechniker ist stolz auf sich und die erbrachte Leistung.
1;Zahntechnikerin;825;f;1;0.6644724104549855;Fachkraefte;PC-Techniker;263;m;None;0.8765312074664593;Fachkraefte;none;none;none;none;Die Zahntechnikerin ist stolz auf sich und die erbrachte Leistung.
1;Zahntechniker;825;m;1;0.33552758954501455;Fachkraefte;Werbetexterin;921;f;None;0.48983357452966714;Spezialisten;none;none;none;none;Der Zahntechniker ist noch unentschlossen.
1;Zahntechnikerin;825;f;1;0.6644724104549855;Fachkraefte;Werbetexter;921;m;None;0.5101664254703329;Spezialisten;none;none;none;none;Die Zahntechnikerin ist noch unentschlossen.
1;Medizintechniker;825;m;1;0.6006423982869379;Spezialisten;Webentwicklerin;431;f;None;0.23245844269466318;Spezialisten;none;none;none;none;Der Medizintechniker ist noch unentschlossen.
1;Medizintechnikerin;825;f;1;0.3993576017130621;Spezialisten;Webentwickler;431;m;None;0.7675415573053368;Spezialisten;none;none;none;none;Die Medizintechnikerin ist noch unentschlossen.
1;Jugendberater;831;m;1;0.23061690365521603;Experten;Türsteherin;531;f;None;0.31309514120615284;Helfer;none;none;none;none;Der Jugendberater merkt, dass er überfordert ist.
1;Jugendberaterin;831;f;1;0.769383096344784;Experten;Türsteher;531;m;None;0.6869048587938471;Helfer;none;none;none;none;Die Jugendberaterin merkt, dass sie überfordert ist.
1;Jugendberater;831;m;1;0.23061690365521603;Experten;Suchttherapeutin;816;f;None;0.8192346424974823;Experten;none;none;none;none;Der Jugendberater ärgert sich über einen gemachten Fehler.
1;Jugendberaterin;831;f;1;0.769383096344784;Experten;Suchttherapeut;816;m;None;0.18076535750251763;Experten;none;none;none;none;Die Jugendberaterin ärgert sich über einen gemachten Fehler.
1;Sozialarbeiter;831;m;1;0.13532923642839417;Fachkraefte;Barkeeperin;633;f;None;0.5681871127055863;Fachkraefte;none;none;none;none;Der Sozialarbeiter bittet jemanden um Hilfe.
1;Sozialarbeiterin;831;f;1;0.8646707635716058;Fachkraefte;Barkeeper;633;m;None;0.43181288729441364;Fachkraefte;none;none;none;none;Die Sozialarbeiterin bittet jemanden um Hilfe.
1;Sozialarbeiter;831;m;1;0.13532923642839417;Fachkraefte;Systemanalytikerin;432;f;None;0.2382269643680432;Experten;none;none;none;none;Der Sozialarbeiter isst Abendbrot um den Hunger zu stillen.
1;Sozialarbeiterin;831;f;1;0.8646707635716058;Fachkraefte;Systemanalytiker;432;m;None;0.7617730356319568;Experten;none;none;none;none;Die Sozialarbeiterin isst Abendbrot um den Hunger zu stillen.
1;Schulbegleiter;831;m;1;0.19059228004375683;Helfer;Papiersortiererin;231;f;None;0.3433029908972692;Helfer;none;none;none;none;Der Schulbegleiter gesteht sich ein, dass er noch keine Entscheidung getrof.
1;Schulbegleiterin;831;f;1;0.8094077199562432;Helfer;Papiersortierer;231;m;None;0.6566970091027308;Helfer;none;none;none;none;Die Schulbegleiterin gesteht sich ein, dass sie noch keine Entscheidung getrof.
1;Schulbegleitung;831;d;1;nan;Helfer;Papiersortierer;231;m;None;0.6566970091027308;Helfer;none;none;none;none;Die Schulbegleitung gesteht sich ein, dass dey noch keine Entscheidung getrof.
1;Schulbegleitung;831;d;1;nan;Helfer;Papiersortiererin;231;f;None;0.3433029908972692;Helfer;none;none;none;none;Die Schulbegleitung gesteht sich ein, dass dey noch keine Entscheidung getrof.
1;Schulbegleiter;831;m;1;0.19059228004375683;Helfer;Kutscherin;113;f;None;0.6703601108033241;Fachkraefte;none;none;none;none;Der Schulbegleiter merkt, dass er überfordert ist.
1;Schulbegleiterin;831;f;1;0.8094077199562432;Helfer;Kutscher;113;m;None;0.3296398891966759;Fachkraefte;none;none;none;none;Die Schulbegleiterin merkt, dass sie überfordert ist.
1;Schulbegleitung;831;d;1;nan;Helfer;Kutscher;113;m;None;0.3296398891966759;Fachkraefte;none;none;none;none;Die Schulbegleitung merkt, dass dey überfordert ist.
1;Schulbegleitung;831;d;1;nan;Helfer;Kutscherin;113;f;None;0.6703601108033241;Fachkraefte;none;none;none;none;Die Schulbegleitung merkt, dass dey überfordert ist.
1;Betreuer;831;m;1;0.19059228004375683;Helfer;Systemprogrammiererin;434;f;None;0.163820704375667;Spezialisten;none;none;none;none;Der Betreuer hat schlechte Laune, weil er gestresst ist.
1;Betreuerin;831;f;1;0.8094077199562432;Helfer;Systemprogrammierer;434;m;None;0.836179295624333;Spezialisten;none;none;none;none;Die Betreuerin hat schlechte Laune, weil sie gestresst ist.
1;Betreuer;831;m;1;0.19059228004375683;Helfer;Biologielaborantin;412;f;None;0.7344451571520205;Fachkraefte;none;none;none;none;Der Betreuer freut sich über eine Gehaltserhöhung.
1;Betreuerin;831;f;1;0.8094077199562432;Helfer;Biologielaborant;412;m;None;0.2655548428479795;Fachkraefte;none;none;none;none;Die Betreuerin freut sich über eine Gehaltserhöhung.
1;Erzieher;831;m;1;0.15455516965001337;Spezialisten;Arzthelferin;811;f;None;0.9731336677485984;Fachkraefte;none;none;none;none;Der Erzieher ärgert sich darüber, dass er einen Fehler gemacht hat.
