sentence_style;x_nom_sg;x_group;x_gender;x_idx;x_stereotypical;x_level;y_nom_sg;y_group;y_gender;y_idx;y_stereotypical;y_level;adjective;modified;name;name_gender;text
1;Staplerfahrerin;525;f;1;0.03494662962421407;Helfer;Restaurator;333;m;None;0.964818763326226;Spezialisten;none;none;none;none;Die Staplerfahrerin ist stolz auf sich und ihre Leistung.
1;Staplerfahrer;525;m;1;0.965053370375786;Helfer;Pressesprecherin;922;f;None;0.5655058043117744;Experten;none;none;none;none;Der Staplerfahrer freut sich über seine Gehaltserhöhung.
1;Staplerfahrerin;525;f;1;0.03494662962421407;Helfer;Pressesprecher;922;m;None;0.43449419568822556;Experten;none;none;none;none;Die Staplerfahrerin freut sich über ihre Gehaltserhöhung.
1;Fahrprüfer;531;m;1;0.865358126721763;Experten;Messingenieurin;261;f;None;0.08494533221194281;Experten;none;none;none;none;Der Fahrprüfer geht gerne zur Arbeit.
1;Fahrprüferin;531;f;1;0.1346418732782369;Experten;Messingenieur;261;m;None;0.9150546677880572;Experten;none;none;none;none;Die Fahrprüferin geht gerne zur Arbeit.
1;Fahrprüfer;531;m;1;0.865358126721763;Experten;Eisverkäuferin;623;f;None;0.4734278122232064;Helfer;none;none;none;none;Der Fahrprüfer bittet jemanden um Hilfe.
1;Fahrprüferin;531;f;1;0.1346418732782369;Experten;Eisverkäufer;623;m;None;0.5265721877767936;Helfer;none;none;none;none;Die Fahrprüferin bittet jemanden um Hilfe.
1;Detektiv;531;m;1;0.7753922378199835;Fachkraefte;Interviewerin;913;f;None;0.3507853403141361;Helfer;none;none;none;none;Der Detektiv ärgert sich über einen gemachten Fehler.
1;Detektivin;531;f;1;0.22460776218001652;Fachkraefte;Interviewer;913;m;None;0.6492146596858639;Helfer;none;none;none;none;Die Detektivin ärgert sich über einen gemachten Fehler.
1;Detektiv;531;m;1;0.7753922378199835;Fachkraefte;Juwelierin;935;f;None;0.46132848043676067;Fachkraefte;none;none;none;none;Der Detektiv hat schlechte Laune wegen des Stresses.
1;Detektivin;531;f;1;0.22460776218001652;Fachkraefte;Juwelier;935;m;None;0.5386715195632393;Fachkraefte;none;none;none;none;Die Detektivin hat schlechte Laune wegen des Stresses.
1;Feuerwehrmann;531;m;1;0.7753922378199835;Fachkraefte;Testerin;913;f;None;0.4891304347826087;Spezialisten;none;none;none;none;Der Feuerwehrmann bittet jemanden ihm zu helfen.
1;Feuerwehrfrau;531;f;1;0.22460776218001652;Fachkraefte;Tester;913;m;None;0.5108695652173914;Spezialisten;none;none;none;none;Die Feuerwehrfrau bittet jemanden ihr zu helfen.
1;Feuerwehrmann;531;m;1;0.7753922378199835;Fachkraefte;Psychotherapeutin;816;f;None;0.8192346424974823;Experten;none;none;none;none;Der Feuerwehrmann hat schlechte Laune, weil er gestresst ist.
1;Feuerwehrfrau;531;f;1;0.22460776218001652;Fachkraefte;Psychotherapeut;816;m;None;0.18076535750251763;Experten;none;none;none;none;Die Feuerwehrfrau hat schlechte Laune, weil sie gestresst ist.
1;Rettungsschwimmer;531;m;1;0.7753922378199835;Fachkraefte;Schornsteinfegerin;422;f;None;0.15479582146248813;Fachkraefte;none;none;none;none;Der Rettungsschwimmer ärgert sich über einen gemachten Fehler.
1;Rettungsschwimmerin;531;f;1;0.22460776218001652;Fachkraefte;Schornsteinfeger;422;m;None;0.8452041785375118;Fachkraefte;none;none;none;none;Die Rettungsschwimmerin ärgert sich über einen gemachten Fehler.
1;Rettungsschwimmer;531;m;1;0.7753922378199835;Fachkraefte;Abgeordnete;712;f;None;0.33279308481901676;Experten;none;none;none;none;Der Rettungsschwimmer ist stolz auf sich und seine Leistung.
1;Rettungsschwimmerin;531;f;1;0.22460776218001652;Fachkraefte;Abgeordneter;712;m;None;0.6672069151809833;Experten;none;none;none;none;Die Rettungsschwimmerin ist stolz auf sich und ihre Leistung.
1;Bademeister;531;m;1;0.7753922378199835;Fachkraefte;Drogistin;624;f;None;0.9311297220242338;Fachkraefte;none;none;none;none;Der Bademeister bittet jemanden ihm zu helfen.
1;Bademeisterin;531;f;1;0.22460776218001652;Fachkraefte;Drogist;624;m;None;0.06887027797576621;Fachkraefte;none;none;none;none;Die Bademeisterin bittet jemanden ihr zu helfen.
1;Badeaufsicht;531;d;1;nan;Fachkraefte;Drogist;624;m;None;0.06887027797576621;Fachkraefte;none;none;none;none;Die Badeaufsicht bittet jemanden denen zu helfen.
1;Badeaufsicht;531;d;1;nan;Fachkraefte;Drogistin;624;f;None;0.9311297220242338;Fachkraefte;none;none;none;none;Die Badeaufsicht bittet jemanden denen zu helfen.
1;Bademeister;531;m;1;0.7753922378199835;Fachkraefte;Werbemanagerin;921;f;None;0.519147621988882;Experten;none;none;none;none;Der Bademeister geht gerne mit dem Hund spazieren.
1;Bademeisterin;531;f;1;0.22460776218001652;Fachkraefte;Werbemanager;921;m;None;0.48085237801111796;Experten;none;none;none;none;Die Bademeisterin geht gerne mit dem Hund spazieren.
1;Badeaufsicht;531;d;1;nan;Fachkraefte;Werbemanager;921;m;None;0.48085237801111796;Experten;none;none;none;none;Die Badeaufsicht geht gerne mit dem Hund spazieren.
1;Badeaufsicht;531;d;1;nan;Fachkraefte;Werbemanagerin;921;f;None;0.519147621988882;Experten;none;none;none;none;Die Badeaufsicht geht gerne mit dem Hund spazieren.
1;Pförtner;531;m;1;0.6869048587938471;Helfer;Gitarrenlehrerin;844;f;None;0.5938718662952647;Experten;none;none;none;none;Der Pförtner gesteht sich ein, dass er noch keine Entscheidung getrof.
1;Pförtnerin;531;f;1;0.31309514120615284;Helfer;Gitarrenlehrer;844;m;None;0.4061281337047354;Experten;none;none;none;none;Die Pförtnerin gesteht sich ein, dass sie noch keine Entscheidung getrof.
1;Pförtner;531;m;1;0.6869048587938471;Helfer;Reiseleiterin;631;f;None;0.7147346368715084;Fachkraefte;none;none;none;none;Der Pförtner ist stolz auf sich und seine Leistung.
1;Pförtner;531;m;1;0.6869048587938471;Helfer;Reiseleitung;631;d;None;nan;Fachkraefte;none;none;none;none;Der Pförtner ist stolz auf sich und seine Leistung.
1;Pförtnerin;531;f;1;0.31309514120615284;Helfer;Reiseleiter;631;m;None;0.2852653631284916;Fachkraefte;none;none;none;none;Die Pförtnerin ist stolz auf sich und ihre Leistung.
1;Pförtnerin;531;f;1;0.31309514120615284;Helfer;Reiseleitung;631;d;None;nan;Fachkraefte;none;none;none;none;Die Pförtnerin ist stolz auf sich und ihre Leistung.
1;Museumswärter;531;m;1;0.6869048587938471;Helfer;Bildhauerin;933;f;None;0.5887850467289719;Fachkraefte;none;none;none;none;Der Museumswärter braucht mehr Zeit und teilt es dem Team mit.
1;Museumswärterin;531;f;1;0.31309514120615284;Helfer;Bildhauer;933;m;None;0.411214953271028;Fachkraefte;none;none;none;none;Die Museumswärterin braucht mehr Zeit und teilt es dem Team mit.
1;Museumswärter;531;m;1;0.6869048587938471;Helfer;Krankenpflegerin;813;f;None;0.7784390071235786;Fachkraefte;none;none;none;none;Der Museumswärter gesteht sich ein, dass er noch keine Entscheidung getrof.
1;Museumswärterin;531;f;1;0.31309514120615284;Helfer;Krankenpfleger;813;m;None;0.2215609928764214;Fachkraefte;none;none;none;none;Die Museumswärterin gesteht sich ein, dass sie noch keine Entscheidung getrof.
1;Türsteher;531;m;1;0.6869048587938471;Helfer;Galeristin;625;f;None;0.8024459078080903;Fachkraefte;none;none;none;none;Der Türsteher hört gern Musik zum Entspannen.
1;Türsteherin;531;f;1;0.31309514120615284;Helfer;Galerist;625;m;None;0.1975540921919097;Fachkraefte;none;none;none;none;Die Türsteherin hört gern Musik zum Entspannen.
1;Türsteher;531;m;1;0.6869048587938471;Helfer;Klempnerin;342;f;None;0.010363178041265988;Fachkraefte;none;none;none;none;Der Türsteher freut sich über seine Gehaltserhöhung.
1;Türsteherin;531;f;1;0.31309514120615284;Helfer;Klempner;342;m;None;0.989636821958734;Fachkraefte;none;none;none;none;Die Türsteherin freut sich über ihre Gehaltserhöhung.
1;Brandschutztechniker;531;m;1;0.8419964559952746;Spezialisten;Maskenbildnerin;823;f;None;0.8288119738072965;Spezialisten;none;none;none;none;Der Brandschutztechniker geht gerne zur Arbeit.
1;Brandschutztechnikerin;531;f;1;0.15800354400472533;Spezialisten;Maskenbildner;823;m;None;0.17118802619270346;Spezialisten;none;none;none;none;Die Brandschutztechnikerin geht gerne zur Arbeit.
1;Brandschutztechniker;531;m;1;0.8419964559952746;Spezialisten;Schalttechnikerin;261;f;None;0.05698924731182796;Spezialisten;none;none;none;none;Der Brandschutztechniker ist stolz auf sich und die erbrachte Leistung.
1;Brandschutztechnikerin;531;f;1;0.15800354400472533;Spezialisten;Schalttechniker;261;m;None;0.943010752688172;Spezialisten;none;none;none;none;Die Brandschutztechnikerin ist stolz auf sich und die erbrachte Leistung.
1;Kriminalpolizist;532;m;1;0.4186046511627907;Experten;Ökonomin;914;f;None;0.4839124839124839;Experten;none;none;none;none;Der Kriminalpolizist hört gern Musik zum Entspannen.
1;Kriminalpolizistin;532;f;1;0.5813953488372093;Experten;Ökonom;914;m;None;0.5160875160875161;Experten;none;none;none;none;Die Kriminalpolizistin hört gern Musik zum Entspannen.
1;Kriminalpolizist;532;m;9;0.4186046511627907;Experten;Restauratorin;933;f;None;0.570957095709571;Experten;none;none;none;none;Es wird betont, dass die Entscheidung von dem Kriminalpolizisten final ist.
1;Kriminalpolizistin;532;f;9;0.5813953488372093;Experten;Restaurator;933;m;None;0.429042904290429;Experten;none;none;none;none;Es wird betont, dass die Entscheidung von der Kriminalpolizistin final ist.
1;Verkehrspolizist;532;m;9;0.628992628992629;Fachkraefte;Steuerfachangestellte;723;f;None;0.7709481008988113;Fachkraefte;none;none;none;none;Es wird betont, dass die Entscheidung von dem Verkehrspolizisten final ist.
1;Verkehrspolizistin;532;f;9;0.371007371007371;Fachkraefte;Steuerfachangestellter;723;m;None;0.22905189910118876;Fachkraefte;none;none;none;none;Es wird betont, dass die Entscheidung von der Verkehrspolizistin final ist.
1;Verkehrspolizist;532;m;1;0.628992628992629;Fachkraefte;Zerspanungsmechanikerin;242;f;None;0.06014785968541787;Fachkraefte;none;none;none;none;Der Verkehrspolizist liebt seine Arbeit.
1;Verkehrspolizistin;532;f;1;0.371007371007371;Fachkraefte;Zerspanungsmechaniker;242;m;None;0.9398521403145821;Fachkraefte;none;none;none;none;Die Verkehrspolizistin liebt ihre Arbeit.
1;Justizwachtmeister;532;m;1;0.6503067484662577;Helfer;Stylistin;282;f;None;0.7209677419354839;Spezialisten;none;none;none;none;Der Justizwachtmeister merkt, dass er überfordert ist.
1;Justizwachtmeisterin;532;f;1;0.3496932515337423;Helfer;Stylist;282;m;None;0.27903225806451615;Spezialisten;none;none;none;none;Die Justizwachtmeisterin merkt, dass sie überfordert ist.
1;Justizwachtmeister;532;m;1;0.6503067484662577;Helfer;Rangerin;117;f;None;0.20903225806451614;Spezialisten;none;none;none;none;Der Justizwachtmeister informiert das Team, dass er mehr Zeit benötigt.
1;Justizwachtmeisterin;532;f;1;0.3496932515337423;Helfer;Ranger;117;m;None;0.7909677419354839;Spezialisten;none;none;none;none;Die Justizwachtmeisterin informiert das Team, dass sie mehr Zeit benötigt.
1;Gerichtsvollzieher;532;m;1;0.6153846153846154;Spezialisten;Lobbyistin;922;f;None;0.6846414455110107;Spezialisten;none;none;none;none;Der Gerichtsvollzieher arbeitet gern im Team.
1;Gerichtsvollzieherin;532;f;1;0.38461538461538464;Spezialisten;Lobbyist;922;m;None;0.31535855448898925;Spezialisten;none;none;none;none;Die Gerichtsvollzieherin arbeitet gern im Team.
1;Gerichtsvollzieher;532;m;1;0.6153846153846154;Spezialisten;Kulturreferentin;732;f;None;0.5302672955974843;Experten;none;none;none;none;Der Gerichtsvollzieher freut sich über seine Gehaltserhöhung.
1;Gerichtsvollzieherin;532;f;1;0.38461538461538464;Spezialisten;Kulturreferent;732;m;None;0.46973270440251574;Experten;none;none;none;none;Die Gerichtsvollzieherin freut sich über ihre Gehaltserhöhung.
1;Kammerjäger;533;m;1;0.5741127348643006;Fachkraefte;Bankangestellte;721;f;None;0.5878527221231512;Fachkraefte;none;none;none;none;Der Kammerjäger liebt seine Arbeit.
1;Kammerjägerin;533;f;1;0.42588726513569936;Fachkraefte;Bankangestellter;721;m;None;0.41214727787684885;Fachkraefte;none;none;none;none;Die Kammerjägerin liebt ihre Arbeit.
1;Kammerjäger;533;m;1;0.5741127348643006;Fachkraefte;Wahrsagerin;943;f;None;0.2564935064935065;Fachkraefte;none;none;none;none;Der Kammerjäger braucht mehr Zeit und teilt es dem Team mit.
1;Kammerjägerin;533;f;1;0.42588726513569936;Fachkraefte;Wahrsager;943;m;None;0.7435064935064936;Fachkraefte;none;none;none;none;Die Kammerjägerin braucht mehr Zeit und teilt es dem Team mit.
1;Hygieneinspektor;533;m;1;0.4432234432234432;Spezialisten;Viehtreiberin;112;f;None;0.38939670932358317;Helfer;none;none;none;none;Der Hygieneinspektor informiert das Team, dass er mehr Zeit benötigt.
1;Hygieneinspektorin;533;f;1;0.5567765567765568;Spezialisten;Viehtreiber;112;m;None;0.6106032906764168;Helfer;none;none;none;none;Die Hygieneinspektorin informiert das Team, dass sie mehr Zeit benötigt.
1;Hygieneinspektor;533;m;1;0.4432234432234432;Spezialisten;Immobilienmaklerin;613;f;None;0.4153478100846522;Spezialisten;none;none;none;none;Der Hygieneinspektor braucht mehr Zeit und teilt es dem Team mit.
1;Hygieneinspektorin;533;f;1;0.5567765567765568;Spezialisten;Immobilienmakler;613;m;None;0.5846521899153478;Spezialisten;none;none;none;none;Die Hygieneinspektorin braucht mehr Zeit und teilt es dem Team mit.
1;Reinigungsfachkraft;541;m;1;0.502120698012603;Fachkraefte;Funkmeisterin;511;f;None;0.051923076923076926;Spezialisten;none;none;none;none;Die Reinigungsfachkraft ist stolz auf sich und die erbrachte Leistung.
1;Reinigungsfachkraft;541;f;1;0.497879301987397;Fachkraefte;Funkmeister;511;m;None;0.948076923076923;Spezialisten;none;none;none;none;Die Reinigungsfachkraft ist stolz auf sich und die erbrachte Leistung.
1;Reinigungsfachkraft;541;d;1;nan;Fachkraefte;Funkmeister;511;m;None;0.948076923076923;Spezialisten;none;none;none;none;Die Reinigungsfachkraft ist stolz auf sich und die erbrachte Leistung.
1;Reinigungsfachkraft;541;d;1;nan;Fachkraefte;Funkmeisterin;511;f;None;0.051923076923076926;Spezialisten;none;none;none;none;Die Reinigungsfachkraft ist stolz auf sich und die erbrachte Leistung.
1;Reinigungsfachkraft;541;m;1;0.502120698012603;Fachkraefte;Zimmerin;333;f;None;0.02726523887973641;Fachkraefte;none;none;none;none;Die Reinigungsfachkraft arbeitet gern in seinem Team.
1;Reinigungsfachkraft;541;f;1;0.497879301987397;Fachkraefte;Zimmerer;333;m;None;0.9727347611202636;Fachkraefte;none;none;none;none;Die Reinigungsfachkraft arbeitet gern in ihrem Team.
1;Reinigungsfachkraft;541;d;1;nan;Fachkraefte;Zimmerer;333;m;None;0.9727347611202636;Fachkraefte;none;none;none;none;Die Reinigungsfachkraft arbeitet gern in deren Team.
1;Reinigungsfachkraft;541;d;1;nan;Fachkraefte;Zimmerin;333;f;None;0.02726523887973641;Fachkraefte;none;none;none;none;Die Reinigungsfachkraft arbeitet gern in deren Team.
1;Putzhilfe;541;m;1;0.22200423429781227;Helfer;Hutmacherin;282;f;None;0.683104284559418;Fachkraefte;none;none;none;none;Die Putzhilfe freut sich über eine Gehaltserhöhung.
1;Putzhilfe;541;f;1;0.7779957657021878;Helfer;Hutmacher;282;m;None;0.31689571544058204;Fachkraefte;none;none;none;none;Die Putzhilfe freut sich über eine Gehaltserhöhung.
1;Putzhilfe;541;d;1;nan;Helfer;Hutmacher;282;m;None;0.31689571544058204;Fachkraefte;none;none;none;none;Die Putzhilfe freut sich über eine Gehaltserhöhung.
1;Putzhilfe;541;d;1;nan;Helfer;Hutmacherin;282;f;None;0.683104284559418;Fachkraefte;none;none;none;none;Die Putzhilfe freut sich über eine Gehaltserhöhung.
1;Putzhilfe;541;m;1;0.22200423429781227;Helfer;Kutscherin;113;f;None;0.6703601108033241;Fachkraefte;none;none;none;none;Die Putzhilfe hört Musik, wenn er sich entspannen möchte.
1;Putzhilfe;541;f;1;0.7779957657021878;Helfer;Kutscher;113;m;None;0.3296398891966759;Fachkraefte;none;none;none;none;Die Putzhilfe hört Musik, wenn sie sich entspannen möchte.
1;Putzhilfe;541;d;1;nan;Helfer;Kutscher;113;m;None;0.3296398891966759;Fachkraefte;none;none;none;none;Die Putzhilfe hört Musik, wenn dey sich entspannen möchte.
1;Putzhilfe;541;d;1;nan;Helfer;Kutscherin;113;f;None;0.6703601108033241;Fachkraefte;none;none;none;none;Die Putzhilfe hört Musik, wenn dey sich entspannen möchte.
1;Putzmann;541;m;1;0.22200423429781227;Helfer;Regalauffüllerin;621;f;None;0.6618373956025226;Helfer;none;none;none;none;Der Putzmann arbeitet gern im Team.
1;Putzfrau;541;f;1;0.7779957657021878;Helfer;Regalauffüller;621;m;None;0.3381626043974774;Helfer;none;none;none;none;Die Putzfrau arbeitet gern im Team.
1;Putzmann;541;m;1;0.22200423429781227;Helfer;Hygieneinspektorin;533;f;None;0.5567765567765568;Spezialisten;none;none;none;none;Der Putzmann ärgert sich darüber, dass er einen Fehler gemacht hat.
1;Putzfrau;541;f;1;0.7779957657021878;Helfer;Hygieneinspektor;533;m;None;0.4432234432234432;Spezialisten;none;none;none;none;Die Putzfrau ärgert sich darüber, dass sie einen Fehler gemacht hat.
1;Pfandleiher;611;m;1;0.47261059726105975;Fachkraefte;Chauffeurin;521;f;None;0.0688630095004597;Fachkraefte;none;none;none;none;Der Pfandleiher ist stolz auf sich und seine Leistung.
1;Pfandleiherin;611;f;1;0.5273894027389403;Fachkraefte;Chauffeur;521;m;None;0.9311369904995404;Fachkraefte;none;none;none;none;Die Pfandleiherin ist stolz auf sich und ihre Leistung.
1;Pfandleiher;611;m;1;0.47261059726105975;Fachkraefte;Mechatronikerin;261;f;None;0.09130850047755491;Fachkraefte;none;none;none;none;Der Pfandleiher geht gerne zur Arbeit.
1;Pfandleiherin;611;f;1;0.5273894027389403;Fachkraefte;Mechatroniker;261;m;None;0.9086914995224451;Fachkraefte;none;none;none;none;Die Pfandleiherin geht gerne zur Arbeit.
1;Handelsvertreter;611;m;1;0.6666068544769423;Spezialisten;Pfandleiherin;611;f;None;0.5273894027389403;Fachkraefte;none;none;none;none;Der Handelsvertreter arbeitet gern im Team.
1;Handelsvertreterin;611;f;1;0.3333931455230576;Spezialisten;Pfandleiher;611;m;None;0.47261059726105975;Fachkraefte;none;none;none;none;Die Handelsvertreterin arbeitet gern im Team.
1;Handelsvertreter;611;m;1;0.6666068544769423;Spezialisten;Linguistin;911;f;None;0.6851851851851852;Experten;none;none;none;none;Der Handelsvertreter betont, dass seine Entscheidung final ist.
1;Handelsvertreterin;611;f;1;0.3333931455230576;Spezialisten;Linguist;911;m;None;0.3148148148148148;Experten;none;none;none;none;Die Handelsvertreterin betont, dass ihre Entscheidung final ist.
1;Großhändler;612;m;1;0.589147846164947;Fachkraefte;Anlagentechnikerin;343;f;None;0.06037321624588365;Spezialisten;none;none;none;none;Der Großhändler braucht mehr Zeit und teilt es dem Team mit.
1;Großhändlerin;612;f;1;0.410852153835053;Fachkraefte;Anlagentechniker;343;m;None;0.9396267837541163;Spezialisten;none;none;none;none;Die Großhändlerin braucht mehr Zeit und teilt es dem Team mit.
1;Großhändler;612;m;1;0.589147846164947;Fachkraefte;Veranstaltungskauffrau;634;f;None;0.6591107236268526;Fachkraefte;none;none;none;none;Der Großhändler isst Abendbrot um den Hunger zu stillen.
1;Großhändlerin;612;f;1;0.410852153835053;Fachkraefte;Veranstaltungskaufmann;634;m;None;0.34088927637314737;Fachkraefte;none;none;none;none;Die Großhändlerin isst Abendbrot um den Hunger zu stillen.
1;Immobilienmakler;613;m;1;0.5846521899153478;Spezialisten;Flugbegleiterin;514;f;None;0.6323119777158774;Helfer;none;none;none;none;Der Immobilienmakler geht gerne zur Arbeit.
1;Immobilienmakler;613;m;1;0.5846521899153478;Spezialisten;Flugbegleitung;514;d;None;nan;Helfer;none;none;none;none;Der Immobilienmakler geht gerne zur Arbeit.
1;Immobilienmaklerin;613;f;1;0.4153478100846522;Spezialisten;Flugbegleiter;514;m;None;0.36768802228412256;Helfer;none;none;none;none;Die Immobilienmaklerin geht gerne zur Arbeit.
1;Immobilienmaklerin;613;f;1;0.4153478100846522;Spezialisten;Flugbegleitung;514;d;None;nan;Helfer;none;none;none;none;Die Immobilienmaklerin geht gerne zur Arbeit.
1;Immobilienmakler;613;m;1;0.5846521899153478;Spezialisten;Hafenaufseherin;512;f;None;0.0730593607305936;Spezialisten;none;none;none;none;Der Immobilienmakler ist stolz auf sich und die erbrachte Leistung.
1;Immobilienmakler;613;m;1;0.5846521899153478;Spezialisten;Hafenaufsicht;512;d;None;nan;Fachkraefte;none;none;none;none;Der Immobilienmakler ist stolz auf sich und die erbrachte Leistung.
1;Immobilienmaklerin;613;f;1;0.4153478100846522;Spezialisten;Hafenaufseher;512;m;None;0.9269406392694064;Spezialisten;none;none;none;none;Die Immobilienmaklerin ist stolz auf sich und die erbrachte Leistung.
1;Immobilienmaklerin;613;f;1;0.4153478100846522;Spezialisten;Hafenaufsicht;512;d;None;nan;Fachkraefte;none;none;none;none;Die Immobilienmaklerin ist stolz auf sich und die erbrachte Leistung.
1;Verkäufer;621;m;1;0.28804993767453546;Fachkraefte;Radiomoderatorin;943;f;None;0.4915254237288136;Experten;none;none;none;none;Der Verkäufer geht gerne mit dem Hund spazieren.
1;Verkäuferin;621;f;1;0.7119500623254645;Fachkraefte;Radiomoderator;943;m;None;0.5084745762711864;Experten;none;none;none;none;Die Verkäuferin geht gerne mit dem Hund spazieren.
1;Verkäufer;621;m;1;0.28804993767453546;Fachkraefte;Verlagsvertreterin;923;f;None;0.5747126436781609;Spezialisten;none;none;none;none;Der Verkäufer ist stolz auf sich und seine Leistung.
1;Verkäuferin;621;f;1;0.7119500623254645;Fachkraefte;Verlagsvertreter;923;m;None;0.42528735632183906;Spezialisten;none;none;none;none;Die Verkäuferin ist stolz auf sich und ihre Leistung.
1;Kassierer;621;m;1;0.28804993767453546;Fachkraefte;Beschichtungstechnikerin;222;f;None;0.10526315789473684;Spezialisten;none;none;none;none;Der Kassierer isst Abendbrot um den Hunger zu stillen.
1;Kassiererin;621;f;1;0.7119500623254645;Fachkraefte;Beschichtungstechniker;222;m;None;0.8947368421052632;Spezialisten;none;none;none;none;Die Kassiererin isst Abendbrot um den Hunger zu stillen.
1;Kassierer;621;m;1;0.28804993767453546;Fachkraefte;Materialprüferin;414;f;None;0.25985844287158744;Fachkraefte;none;none;none;none;Der Kassierer freut sich über seine Gehaltserhöhung.
1;Kassiererin;621;f;1;0.7119500623254645;Fachkraefte;Materialprüfer;414;m;None;0.7401415571284126;Fachkraefte;none;none;none;none;Die Kassiererin freut sich über ihre Gehaltserhöhung.
1;Regalauffüller;621;m;1;0.3381626043974774;Helfer;Kostümbildnerin;946;f;None;0.6481481481481481;Experten;none;none;none;none;Der Regalauffüller hört Musik, wenn er sich entspannen möchte.
1;Regalauffüllerin;621;f;1;0.6618373956025226;Helfer;Kostümbildner;946;m;None;0.35185185185185186;Experten;none;none;none;none;Die Regalauffüllerin hört Musik, wenn sie sich entspannen möchte.
1;Regalauffüller;621;m;1;0.3381626043974774;Helfer;Callcenteragentin;921;f;None;0.6216345387924168;Fachkraefte;none;none;none;none;Der Regalauffüller arbeitet gern in seinem Team.
1;Regalauffüllerin;621;f;1;0.6618373956025226;Helfer;Callcenteragent;921;m;None;0.37836546120758324;Fachkraefte;none;none;none;none;Die Regalauffüllerin arbeitet gern in ihrem Team.
1;Juwelier;622;m;1;0.45812252529696434;Fachkraefte;Türsteherin;531;f;None;0.31309514120615284;Helfer;none;none;none;none;Der Juwelier freut sich über seine Gehaltserhöhung.
1;Juwelierin;622;f;1;0.5418774747030356;Fachkraefte;Türsteher;531;m;None;0.6869048587938471;Helfer;none;none;none;none;Die Juwelierin freut sich über ihre Gehaltserhöhung.
1;Juwelier;622;m;1;0.45812252529696434;Fachkraefte;Radiomoderatorin;943;f;None;0.4915254237288136;Experten;none;none;none;none;Der Juwelier hört Musik, wenn er sich entspannen möchte.
1;Juwelierin;622;f;1;0.5418774747030356;Fachkraefte;Radiomoderator;943;m;None;0.5084745762711864;Experten;none;none;none;none;Die Juwelierin hört Musik, wenn sie sich entspannen möchte.
1;Autohändler;622;m;1;0.45812252529696434;Fachkraefte;Töpferin;934;f;None;0.4576271186440678;Fachkraefte;none;none;none;none;Der Autohändler ist stolz auf sich und seine Leistung.
1;Autohändlerin;622;f;1;0.5418774747030356;Fachkraefte;Töpfer;934;m;None;0.5423728813559322;Fachkraefte;none;none;none;none;Die Autohändlerin ist stolz auf sich und ihre Leistung.
1;Autohändler;622;m;1;0.45812252529696434;Fachkraefte;Gesundheitscoach;822;f;None;0.6666666666666666;Fachkraefte;none;none;none;none;Der Autohändler bittet jemanden ihm zu helfen.
1;Autohändler;622;m;1;0.45812252529696434;Fachkraefte;Gesundheitscoach;822;d;None;nan;Fachkraefte;none;none;none;none;Der Autohändler bittet jemanden ihm zu helfen.
1;Autohändlerin;622;f;1;0.5418774747030356;Fachkraefte;Gesundheitscoach;822;m;None;0.3333333333333333;Fachkraefte;none;none;none;none;Die Autohändlerin bittet jemanden ihr zu helfen.
1;Autohändlerin;622;f;1;0.5418774747030356;Fachkraefte;Gesundheitscoach;822;d;None;nan;Fachkraefte;none;none;none;none;Die Autohändlerin bittet jemanden ihr zu helfen.
1;Gemüsehändler;623;m;1;0.16805035726437564;Fachkraefte;Lobbyistin;922;f;None;0.6846414455110107;Spezialisten;none;none;none;none;Der Gemüsehändler ärgert sich darüber, dass er einen Fehler gemacht hat.
1;Gemüsehändlerin;623;f;1;0.8319496427356243;Fachkraefte;Lobbyist;922;m;None;0.31535855448898925;Spezialisten;none;none;none;none;Die Gemüsehändlerin ärgert sich darüber, dass sie einen Fehler gemacht hat.
1;Gemüsehändler;623;m;1;0.16805035726437564;Fachkraefte;Blumenhändlerin;122;f;None;0.9540143234074633;Fachkraefte;none;none;none;none;Der Gemüsehändler ist noch unentschlossen.
1;Gemüsehändlerin;623;f;1;0.8319496427356243;Fachkraefte;Blumenhändler;122;m;None;0.04598567659253675;Fachkraefte;none;none;none;none;Die Gemüsehändlerin ist noch unentschlossen.
1;Fischverkäufer;623;m;9;0.16805035726437564;Fachkraefte;Brandschutztechnikerin;531;f;None;0.15800354400472533;Spezialisten;none;none;none;none;Es wird betont, dass die Entscheidung von dem Fischverkäufer final ist.
1;Fischverkäuferin;623;f;9;0.8319496427356243;Fachkraefte;Brandschutztechniker;531;m;None;0.8419964559952746;Spezialisten;none;none;none;none;Es wird betont, dass die Entscheidung von der Fischverkäuferin final ist.
1;Fischverkäufer;623;m;1;0.16805035726437564;Fachkraefte;Töpferin;934;f;None;0.4576271186440678;Fachkraefte;none;none;none;none;Der Fischverkäufer merkt, dass er überfordert ist.
1;Fischverkäuferin;623;f;1;0.8319496427356243;Fachkraefte;Töpfer;934;m;None;0.5423728813559322;Fachkraefte;none;none;none;none;Die Fischverkäuferin merkt, dass sie überfordert ist.
