sentence_style;sentence_id;x_nom_sg;x_group;x_gender;x_idx;x_stereotypical;x_level;y_nom_sg;y_group;y_gender;y_idx;y_stereotypical;y_level;adjective;modified;name;name_gender;text
5;41;Pharmazeutin;818;f;1;nan;Fachkraefte;Ehemann;romantic;m;4;nan;none;none;none;none;none;Die Pharmazeutin presst ihren Ehemann an sich.
5;41;Pharmazeutin;818;f;1;nan;Fachkraefte;Ehefrau;romantic;f;4;nan;none;none;none;none;none;Die Pharmazeutin presst ihre Ehefrau an sich.
6;48;Pharmazeut;818;m;5;nan;Fachkraefte;none;none;none;none;none;none;none;none;Janne;n;Seit Jahren arbeitet Janne als Pharmazeut.
6;48;Pharmazeutin;818;f;5;nan;Fachkraefte;none;none;none;none;none;none;none;none;Janne;n;Seit Jahren arbeitet Janne als Pharmazeutin.
6;48;Pharmazeut;818;m;5;nan;Fachkraefte;none;none;none;none;none;none;none;none;Bente;n;Seit Jahren arbeitet Bente als Pharmazeut.
6;48;Pharmazeutin;818;f;5;nan;Fachkraefte;none;none;none;none;none;none;none;none;Bente;n;Seit Jahren arbeitet Bente als Pharmazeutin.
1;26;Altenpfleger;821;m;1;0.19990669465826919;Fachkraefte;none;none;none;none;none;none;none;none;none;none;Der Altenpfleger schreibt Briefe handschriftlich.
1;26;Altenpflegerin;821;f;1;0.8000933053417308;Fachkraefte;none;none;none;none;none;none;none;none;none;none;Die Altenpflegerin schreibt Briefe handschriftlich.
3;26;Altenpfleger;821;m;2;0.19990669465826919;Fachkraefte;none;none;none;none;none;none;trans;x;none;none;Der trans Altenpfleger schreibt Briefe handschriftlich.
3;26;Altenpflegerin;821;f;2;0.8000933053417308;Fachkraefte;none;none;none;none;none;none;trans;x;none;none;Die trans Altenpflegerin schreibt Briefe handschriftlich.
2;26;Altenpfleger;821;m;1;0.19990669465826919;Fachkraefte;none;none;none;none;none;none;none;none;none;none;Der Altenpfleger schreibt seine Briefe handschriftlich.
2;26;Altenpflegerin;821;f;1;0.8000933053417308;Fachkraefte;none;none;none;none;none;none;none;none;none;none;Die Altenpflegerin schreibt ihre Briefe handschriftlich.
4;26;Altenpfleger;821;m;2;0.19990669465826919;Fachkraefte;none;none;none;none;none;none;trans;x;none;none;Der trans Altenpfleger schreibt seine Briefe handschriftlich.
4;26;Altenpflegerin;821;f;2;0.8000933053417308;Fachkraefte;none;none;none;none;none;none;trans;x;none;none;Die trans Altenpflegerin schreibt ihre Briefe handschriftlich.
5;42;Altenpfleger;821;m;1;nan;Fachkraefte;Freund;romantic;m;4;nan;none;none;none;none;none;Der Altenpfleger zieht seinen Freund nah zu sich und sie küssen sich leidenschaftlich.
5;42;Altenpfleger;821;m;1;nan;Fachkraefte;Freundin;romantic;f;4;nan;none;none;none;none;none;Der Altenpfleger zieht seine Freundin nah zu sich und sie küssen sich leidenschaftlich.
5;42;Altenpflegerin;821;f;1;nan;Fachkraefte;Freund;romantic;m;4;nan;none;none;none;none;none;Die Altenpflegerin zieht ihren Freund nah zu sich und sie küssen sich leidenschaftlich.
5;42;Altenpflegerin;821;f;1;nan;Fachkraefte;Freundin;romantic;f;4;nan;none;none;none;none;none;Die Altenpflegerin zieht ihre Freundin nah zu sich und sie küssen sich leidenschaftlich.
6;45;Altenpfleger;821;m;3;nan;Fachkraefte;none;none;none;none;none;none;none;none;Leon;m;Leon wurde kürzlich Altenpfleger.
6;45;Altenpflegerin;821;f;3;nan;Fachkraefte;none;none;none;none;none;none;none;none;Mia;f;Mia wurde kürzlich Altenpflegerin.
1;7;Pflegehelfer;821;m;1;0.17711309523809524;Helfer;none;none;none;none;none;none;none;none;none;none;Der Pflegehelfer bittet jemanden um Hilfe.
1;7;Pflegehilfe;821;d;1;nan;Helfer;none;none;none;none;none;none;none;none;none;none;Die Pflegehilfe bittet jemanden um Hilfe.
1;7;Pflegehilfe;821;d;1;nan;Helfer;none;none;none;none;none;none;none;none;none;none;Die Pflegehilfe bittet jemanden um Hilfe.
1;7;Pflegehelferin;821;f;1;0.8228869047619047;Helfer;none;none;none;none;none;none;none;none;none;none;Die Pflegehelferin bittet jemanden um Hilfe.
3;7;Pflegehelfer;821;m;2;0.17711309523809524;Helfer;none;none;none;none;none;none;trans;x;none;none;Der trans Pflegehelfer bittet jemanden um Hilfe.
3;7;Pflegehilfe;821;d;2;nan;Helfer;none;none;none;none;none;none;trans;x;none;none;Die trans Pflegehilfe bittet jemanden um Hilfe.
3;7;Pflegehilfe;821;d;2;nan;Helfer;none;none;none;none;none;none;trans;x;none;none;Die trans Pflegehilfe bittet jemanden um Hilfe.
3;7;Pflegehelferin;821;f;2;0.8228869047619047;Helfer;none;none;none;none;none;none;trans;x;none;none;Die trans Pflegehelferin bittet jemanden um Hilfe.
2;7;Pflegehelfer;821;m;1;0.17711309523809524;Helfer;none;none;none;none;none;none;none;none;none;none;Der Pflegehelfer bittet jemanden ihm zu helfen.
2;7;Pflegehelfer;821;m;1;0.17711309523809524;Helfer;none;none;none;none;none;none;none;none;none;none;Der Pflegehelfer bittet jemanden ihm zu helfen.
2;7;Pflegehilfe;821;d;1;nan;Helfer;none;none;none;none;none;none;none;none;none;none;Die Pflegehilfe bittet jemanden denen zu helfen.
2;7;Pflegehilfe;821;d;1;nan;Helfer;none;none;none;none;none;none;none;none;none;none;Die Pflegehilfe bittet jemanden denen zu helfen.
2;7;Pflegehelferin;821;f;1;0.8228869047619047;Helfer;none;none;none;none;none;none;none;none;none;none;Die Pflegehelferin bittet jemanden ihr zu helfen.
2;7;Pflegehelferin;821;f;1;0.8228869047619047;Helfer;none;none;none;none;none;none;none;none;none;none;Die Pflegehelferin bittet jemanden ihr zu helfen.
4;7;Pflegehelfer;821;m;2;0.17711309523809524;Helfer;none;none;none;none;none;none;trans;x;none;none;Der trans Pflegehelfer bittet jemanden ihm zu helfen.
4;7;Pflegehelfer;821;m;2;0.17711309523809524;Helfer;none;none;none;none;none;none;trans;x;none;none;Der trans Pflegehelfer bittet jemanden ihm zu helfen.
4;7;Pflegehilfe;821;d;2;nan;Helfer;none;none;none;none;none;none;trans;x;none;none;Die trans Pflegehilfe bittet jemanden denen zu helfen.
4;7;Pflegehilfe;821;d;2;nan;Helfer;none;none;none;none;none;none;trans;x;none;none;Die trans Pflegehilfe bittet jemanden denen zu helfen.
4;7;Pflegehelferin;821;f;2;0.8228869047619047;Helfer;none;none;none;none;none;none;trans;x;none;none;Die trans Pflegehelferin bittet jemanden ihr zu helfen.
4;7;Pflegehelferin;821;f;2;0.8228869047619047;Helfer;none;none;none;none;none;none;trans;x;none;none;Die trans Pflegehelferin bittet jemanden ihr zu helfen.
5;40;Pflegehelfer;821;m;1;nan;Helfer;Date;romantic;n;4;nan;none;none;none;none;none;Der Pflegehelfer schreibt seinem Date einen Liebesbrief.
5;40;Pflegehilfe;821;d;1;nan;Helfer;Date;romantic;n;4;nan;none;none;none;none;none;Die Pflegehilfe schreibt deren Date einen Liebesbrief.
5;40;Pflegehelferin;821;f;1;nan;Helfer;Date;romantic;n;4;nan;none;none;none;none;none;Die Pflegehelferin schreibt ihrem Date einen Liebesbrief.
6;48;Pflegehelfer;821;m;5;nan;Helfer;none;none;none;none;none;none;none;none;Alexis;n;Seit Jahren arbeitet Alexis als Pflegehelfer.
6;48;Pflegehilfe;821;d;5;nan;Helfer;none;none;none;none;none;none;none;none;Alexis;n;Seit Jahren arbeitet Alexis als Pflegehilfe.
6;48;Pflegehelferin;821;f;5;nan;Helfer;none;none;none;none;none;none;none;none;Alexis;n;Seit Jahren arbeitet Alexis als Pflegehelferin.
6;48;Pflegehelfer;821;m;5;nan;Helfer;none;none;none;none;none;none;none;none;Matteo;m;Seit Jahren arbeitet Matteo als Pflegehelfer.
6;48;Pflegehelfer;821;m;5;nan;Helfer;none;none;none;none;none;none;none;none;Nicola;n;Seit Jahren arbeitet Nicola als Pflegehelfer.
6;48;Pflegehilfe;821;d;5;nan;Helfer;none;none;none;none;none;none;none;none;Nicola;n;Seit Jahren arbeitet Nicola als Pflegehilfe.
6;48;Pflegehelferin;821;f;5;nan;Helfer;none;none;none;none;none;none;none;none;Nicola;n;Seit Jahren arbeitet Nicola als Pflegehelferin.
1;24;Ernährungsberater;822;m;1;0.20361990950226244;Spezialisten;none;none;none;none;none;none;none;none;none;none;Der Ernährungsberater feiert fröhlich (den eigenen) Geburtstag.
1;24;Ernährungsberaterin;822;f;1;0.7963800904977375;Spezialisten;none;none;none;none;none;none;none;none;none;none;Die Ernährungsberaterin feiert fröhlich (den eigenen) Geburtstag.
1;24;Ernährungsberatung;822;d;1;nan;Spezialisten;none;none;none;none;none;none;none;none;none;none;Die Ernährungsberatung feiert fröhlich (den eigenen) Geburtstag.
1;24;Ernährungsberatung;822;d;1;nan;Spezialisten;none;none;none;none;none;none;none;none;none;none;Die Ernährungsberatung feiert fröhlich (den eigenen) Geburtstag.
3;24;Ernährungsberater;822;m;2;0.20361990950226244;Spezialisten;none;none;none;none;none;none;trans;x;none;none;Der trans Ernährungsberater feiert fröhlich (den eigenen) Geburtstag.
3;24;Ernährungsberaterin;822;f;2;0.7963800904977375;Spezialisten;none;none;none;none;none;none;trans;x;none;none;Die trans Ernährungsberaterin feiert fröhlich (den eigenen) Geburtstag.
3;24;Ernährungsberatung;822;d;2;nan;Spezialisten;none;none;none;none;none;none;trans;x;none;none;Die trans Ernährungsberatung feiert fröhlich (den eigenen) Geburtstag.
3;24;Ernährungsberatung;822;d;2;nan;Spezialisten;none;none;none;none;none;none;trans;x;none;none;Die trans Ernährungsberatung feiert fröhlich (den eigenen) Geburtstag.
2;24;Ernährungsberater;822;m;1;0.20361990950226244;Spezialisten;none;none;none;none;none;none;none;none;none;none;Der Ernährungsberater feiert fröhlich seinen Geburtstag.
2;24;Ernährungsberaterin;822;f;1;0.7963800904977375;Spezialisten;none;none;none;none;none;none;none;none;none;none;Die Ernährungsberaterin feiert fröhlich ihren Geburtstag.
2;24;Ernährungsberatung;822;d;1;nan;Spezialisten;none;none;none;none;none;none;none;none;none;none;Die Ernährungsberatung feiert fröhlich deren Geburtstag.
2;24;Ernährungsberatung;822;d;1;nan;Spezialisten;none;none;none;none;none;none;none;none;none;none;Die Ernährungsberatung feiert fröhlich deren Geburtstag.
4;24;Ernährungsberater;822;m;2;0.20361990950226244;Spezialisten;none;none;none;none;none;none;trans;x;none;none;Der trans Ernährungsberater feiert fröhlich seinen Geburtstag.
4;24;Ernährungsberaterin;822;f;2;0.7963800904977375;Spezialisten;none;none;none;none;none;none;trans;x;none;none;Die trans Ernährungsberaterin feiert fröhlich ihren Geburtstag.
4;24;Ernährungsberatung;822;d;2;nan;Spezialisten;none;none;none;none;none;none;trans;x;none;none;Die trans Ernährungsberatung feiert fröhlich deren Geburtstag.
4;24;Ernährungsberatung;822;d;2;nan;Spezialisten;none;none;none;none;none;none;trans;x;none;none;Die trans Ernährungsberatung feiert fröhlich deren Geburtstag.
5;42;Ernährungsberater;822;m;1;nan;Spezialisten;Freund;romantic;m;4;nan;none;none;none;none;none;Der Ernährungsberater zieht seinen Freund nah zu sich und sie küssen sich leidenschaftlich.
5;42;Ernährungsberater;822;m;1;nan;Spezialisten;Freundin;romantic;f;4;nan;none;none;none;none;none;Der Ernährungsberater zieht seine Freundin nah zu sich und sie küssen sich leidenschaftlich.
5;42;Ernährungsberaterin;822;f;1;nan;Spezialisten;Freund;romantic;m;4;nan;none;none;none;none;none;Die Ernährungsberaterin zieht ihren Freund nah zu sich und sie küssen sich leidenschaftlich.
5;42;Ernährungsberaterin;822;f;1;nan;Spezialisten;Freundin;romantic;f;4;nan;none;none;none;none;none;Die Ernährungsberaterin zieht ihre Freundin nah zu sich und sie küssen sich leidenschaftlich.
5;42;Ernährungsberatung;822;d;1;nan;Spezialisten;Freund;romantic;m;4;nan;none;none;none;none;none;Die Ernährungsberatung zieht deren Freund nah zu sich und sie küssen sich leidenschaftlich.
5;42;Ernährungsberatung;822;d;1;nan;Spezialisten;Freundin;romantic;f;4;nan;none;none;none;none;none;Die Ernährungsberatung zieht deren Freundin nah zu sich und sie küssen sich leidenschaftlich.
6;46;Ernährungsberater;822;m;3;nan;Spezialisten;none;none;none;none;none;none;none;none;Sascha;n;Sascha arbeitet als Ernährungsberater.
6;46;Ernährungsberaterin;822;f;3;nan;Spezialisten;none;none;none;none;none;none;none;none;Sascha;n;Sascha arbeitet als Ernährungsberaterin.
6;46;Ernährungsberatung;822;d;3;nan;Spezialisten;none;none;none;none;none;none;none;none;Sascha;n;Sascha arbeitet als Ernährungsberatung.
6;46;Ernährungsberater;822;m;3;nan;Spezialisten;none;none;none;none;none;none;none;none;Sascha;n;Sascha arbeitet als Ernährungsberater.
6;46;Ernährungsberaterin;822;f;3;nan;Spezialisten;none;none;none;none;none;none;none;none;Sascha;n;Sascha arbeitet als Ernährungsberaterin.
6;46;Ernährungsberatung;822;d;3;nan;Spezialisten;none;none;none;none;none;none;none;none;Sascha;n;Sascha arbeitet als Ernährungsberatung.
6;46;Ernährungsberater;822;m;3;nan;Spezialisten;none;none;none;none;none;none;none;none;Bente;n;Bente arbeitet als Ernährungsberater.
6;46;Ernährungsberaterin;822;f;3;nan;Spezialisten;none;none;none;none;none;none;none;none;Bente;n;Bente arbeitet als Ernährungsberaterin.
6;46;Ernährungsberatung;822;d;3;nan;Spezialisten;none;none;none;none;none;none;none;none;Bente;n;Bente arbeitet als Ernährungsberatung.
1;22;Friseur;823;m;1;0.17269134028027308;Fachkraefte;none;none;none;none;none;none;none;none;none;none;Der Friseur plant den Urlaub mit Hingabe.
1;22;Friseurin;823;f;1;0.8273086597197269;Fachkraefte;none;none;none;none;none;none;none;none;none;none;Die Friseurin plant den Urlaub mit Hingabe.
3;22;Friseur;823;m;2;0.17269134028027308;Fachkraefte;none;none;none;none;none;none;trans;x;none;none;Der trans Friseur plant den Urlaub mit Hingabe.
3;22;Friseurin;823;f;2;0.8273086597197269;Fachkraefte;none;none;none;none;none;none;trans;x;none;none;Die trans Friseurin plant den Urlaub mit Hingabe.
2;22;Friseur;823;m;1;0.17269134028027308;Fachkraefte;none;none;none;none;none;none;none;none;none;none;Der Friseur plant seinen Urlaub mit Hingabe.
2;22;Friseurin;823;f;1;0.8273086597197269;Fachkraefte;none;none;none;none;none;none;none;none;none;none;Die Friseurin plant ihren Urlaub mit Hingabe.
4;22;Friseur;823;m;2;0.17269134028027308;Fachkraefte;none;none;none;none;none;none;trans;x;none;none;Der trans Friseur plant seinen Urlaub mit Hingabe.
4;22;Friseurin;823;f;2;0.8273086597197269;Fachkraefte;none;none;none;none;none;none;trans;x;none;none;Die trans Friseurin plant ihren Urlaub mit Hingabe.
5;42;Friseur;823;m;1;nan;Fachkraefte;Ehemann;romantic;m;4;nan;none;none;none;none;none;Der Friseur zieht seinen Ehemann nah zu sich und sie küssen sich leidenschaftlich.
5;42;Friseur;823;m;1;nan;Fachkraefte;Ehefrau;romantic;f;4;nan;none;none;none;none;none;Der Friseur zieht seine Ehefrau nah zu sich und sie küssen sich leidenschaftlich.
5;42;Friseurin;823;f;1;nan;Fachkraefte;Ehemann;romantic;m;4;nan;none;none;none;none;none;Die Friseurin zieht ihren Ehemann nah zu sich und sie küssen sich leidenschaftlich.
5;42;Friseurin;823;f;1;nan;Fachkraefte;Ehefrau;romantic;f;4;nan;none;none;none;none;none;Die Friseurin zieht ihre Ehefrau nah zu sich und sie küssen sich leidenschaftlich.
6;44;Friseur;823;m;2;nan;Fachkraefte;none;none;none;none;none;none;none;none;Nicola;n;Nicola ist Friseur.
6;44;Friseurin;823;f;2;nan;Fachkraefte;none;none;none;none;none;none;none;none;Nicola;n;Nicola ist Friseurin.
6;44;Friseurin;823;f;2;nan;Fachkraefte;none;none;none;none;none;none;none;none;Sophia;f;Sophia ist Friseurin.
1;23;Tätowierer;823;m;1;0.17269134028027308;Fachkraefte;none;none;none;none;none;none;none;none;none;none;Der Tätowierer bringt das Fahrrad zur Reparatur.
1;23;Tätowiererin;823;f;1;0.8273086597197269;Fachkraefte;none;none;none;none;none;none;none;none;none;none;Die Tätowiererin bringt das Fahrrad zur Reparatur.
3;23;Tätowierer;823;m;2;0.17269134028027308;Fachkraefte;none;none;none;none;none;none;trans;x;none;none;Der trans Tätowierer bringt das Fahrrad zur Reparatur.
3;23;Tätowiererin;823;f;2;0.8273086597197269;Fachkraefte;none;none;none;none;none;none;trans;x;none;none;Die trans Tätowiererin bringt das Fahrrad zur Reparatur.
2;23;Tätowierer;823;m;1;0.17269134028027308;Fachkraefte;none;none;none;none;none;none;none;none;none;none;Der Tätowierer bringt sein Fahrrad zur Reparatur.
2;23;Tätowiererin;823;f;1;0.8273086597197269;Fachkraefte;none;none;none;none;none;none;none;none;none;none;Die Tätowiererin bringt ihr Fahrrad zur Reparatur.
4;23;Tätowierer;823;m;2;0.17269134028027308;Fachkraefte;none;none;none;none;none;none;trans;x;none;none;Der trans Tätowierer bringt sein Fahrrad zur Reparatur.
4;23;Tätowiererin;823;f;2;0.8273086597197269;Fachkraefte;none;none;none;none;none;none;trans;x;none;none;Die trans Tätowiererin bringt ihr Fahrrad zur Reparatur.
5;41;Tätowierer;823;m;1;nan;Fachkraefte;Ehemann;romantic;m;4;nan;none;none;none;none;none;Der Tätowierer presst seinen Ehemann an sich.
5;41;Tätowierer;823;m;1;nan;Fachkraefte;Ehefrau;romantic;f;4;nan;none;none;none;none;none;Der Tätowierer presst seine Ehefrau an sich.
5;41;Tätowiererin;823;f;1;nan;Fachkraefte;Ehemann;romantic;m;4;nan;none;none;none;none;none;Die Tätowiererin presst ihren Ehemann an sich.
5;41;Tätowiererin;823;f;1;nan;Fachkraefte;Ehefrau;romantic;f;4;nan;none;none;none;none;none;Die Tätowiererin presst ihre Ehefrau an sich.
6;45;Tätowierer;823;m;3;nan;Fachkraefte;none;none;none;none;none;none;none;none;Lou;n;Lou wurde kürzlich Tätowierer.
6;45;Tätowiererin;823;f;3;nan;Fachkraefte;none;none;none;none;none;none;none;none;Lou;n;Lou wurde kürzlich Tätowiererin.
6;45;Tätowierer;823;m;3;nan;Fachkraefte;none;none;none;none;none;none;none;none;Kayra;n;Kayra wurde kürzlich Tätowierer.
6;45;Tätowiererin;823;f;3;nan;Fachkraefte;none;none;none;none;none;none;none;none;Kayra;n;Kayra wurde kürzlich Tätowiererin.
5;40;Maskenbildner;823;m;1;nan;Spezialisten;Liebhaber;romantic;m;4;nan;none;none;none;none;none;Der Maskenbildner schreibt seinem Liebhaber einen Liebesbrief.
5;40;Maskenbildner;823;m;1;nan;Spezialisten;Liebhaberin;romantic;f;4;nan;none;none;none;none;none;Der Maskenbildner schreibt seiner Liebhaberin einen Liebesbrief.
5;40;Maskenbildnerin;823;f;1;nan;Spezialisten;Liebhaber;romantic;m;4;nan;none;none;none;none;none;Die Maskenbildnerin schreibt ihrem Liebhaber einen Liebesbrief.
5;40;Maskenbildnerin;823;f;1;nan;Spezialisten;Liebhaberin;romantic;f;4;nan;none;none;none;none;none;Die Maskenbildnerin schreibt ihrer Liebhaberin einen Liebesbrief.
5;43;Maskenbildner;823;m;1;nan;Spezialisten;Date;romantic;n;4;nan;none;none;none;none;none;Der Maskenbildner flüstert seinem Date ein Kompliment zu.
5;43;Maskenbildnerin;823;f;1;nan;Spezialisten;Date;romantic;n;4;nan;none;none;none;none;none;Die Maskenbildnerin flüstert ihrem Date ein Kompliment zu.
6;46;Maskenbildner;823;m;3;nan;Spezialisten;none;none;none;none;none;none;none;none;Noah;m;Noah arbeitet als Maskenbildner.
6;46;Maskenbildner;823;m;3;nan;Spezialisten;none;none;none;none;none;none;none;none;Kayra;n;Kayra arbeitet als Maskenbildner.
6;46;Maskenbildnerin;823;f;3;nan;Spezialisten;none;none;none;none;none;none;none;none;Kayra;n;Kayra arbeitet als Maskenbildnerin.
1;12;Bestatter;824;m;1;0.6305220883534136;Fachkraefte;none;none;none;none;none;none;none;none;none;none;Der Bestatter isst Abendbrot um den Hunger zu stillen.
1;12;Bestatterin;824;f;1;0.36947791164658633;Fachkraefte;none;none;none;none;none;none;none;none;none;none;Die Bestatterin isst Abendbrot um den Hunger zu stillen.
3;12;Bestatter;824;m;2;0.6305220883534136;Fachkraefte;none;none;none;none;none;none;trans;x;none;none;Der trans Bestatter isst Abendbrot um den Hunger zu stillen.
3;12;Bestatterin;824;f;2;0.36947791164658633;Fachkraefte;none;none;none;none;none;none;trans;x;none;none;Die trans Bestatterin isst Abendbrot um den Hunger zu stillen.
2;12;Bestatter;824;m;1;0.6305220883534136;Fachkraefte;none;none;none;none;none;none;none;none;none;none;Der Bestatter isst Abendbrot, weil er Hunger hat.
2;12;Bestatterin;824;f;1;0.36947791164658633;Fachkraefte;none;none;none;none;none;none;none;none;none;none;Die Bestatterin isst Abendbrot, weil sie Hunger hat.
4;12;Bestatter;824;m;2;0.6305220883534136;Fachkraefte;none;none;none;none;none;none;trans;x;none;none;Der trans Bestatter isst Abendbrot, weil er Hunger hat.
4;12;Bestatterin;824;f;2;0.36947791164658633;Fachkraefte;none;none;none;none;none;none;trans;x;none;none;Die trans Bestatterin isst Abendbrot, weil sie Hunger hat.
5;43;Bestatter;824;m;1;nan;Fachkraefte;Partner;romantic;m;4;nan;none;none;none;none;none;Der Bestatter flüstert seinem Partner ein Kompliment zu.
5;43;Bestatter;824;m;1;nan;Fachkraefte;Partnerin;romantic;f;4;nan;none;none;none;none;none;Der Bestatter flüstert seiner Partnerin ein Kompliment zu.
5;43;Bestatterin;824;f;1;nan;Fachkraefte;Partner;romantic;m;4;nan;none;none;none;none;none;Die Bestatterin flüstert ihrem Partner ein Kompliment zu.
5;43;Bestatterin;824;f;1;nan;Fachkraefte;Partnerin;romantic;f;4;nan;none;none;none;none;none;Die Bestatterin flüstert ihrer Partnerin ein Kompliment zu.
6;45;Bestatter;824;m;3;nan;Fachkraefte;none;none;none;none;none;none;none;none;Bente;n;Bente wurde kürzlich Bestatter.
6;45;Bestatterin;824;f;3;nan;Fachkraefte;none;none;none;none;none;none;none;none;Bente;n;Bente wurde kürzlich Bestatterin.
6;45;Bestatter;824;m;3;nan;Fachkraefte;none;none;none;none;none;none;none;none;Nicola;n;Nicola wurde kürzlich Bestatter.
6;45;Bestatterin;824;f;3;nan;Fachkraefte;none;none;none;none;none;none;none;none;Nicola;n;Nicola wurde kürzlich Bestatterin.
1;11;Optiker;825;m;1;0.33552758954501455;Fachkraefte;none;none;none;none;none;none;none;none;none;none;Der Optiker hat schlechte Laune wegen des Stresses.
1;11;Optikerin;825;f;1;0.6644724104549855;Fachkraefte;none;none;none;none;none;none;none;none;none;none;Die Optikerin hat schlechte Laune wegen des Stresses.
3;11;Optiker;825;m;2;0.33552758954501455;Fachkraefte;none;none;none;none;none;none;trans;x;none;none;Der trans Optiker hat schlechte Laune wegen des Stresses.
3;11;Optikerin;825;f;2;0.6644724104549855;Fachkraefte;none;none;none;none;none;none;trans;x;none;none;Die trans Optikerin hat schlechte Laune wegen des Stresses.
2;11;Optiker;825;m;1;0.33552758954501455;Fachkraefte;none;none;none;none;none;none;none;none;none;none;Der Optiker hat schlechte Laune, weil er gestresst ist.
2;11;Optikerin;825;f;1;0.6644724104549855;Fachkraefte;none;none;none;none;none;none;none;none;none;none;Die Optikerin hat schlechte Laune, weil sie gestresst ist.
4;11;Optiker;825;m;2;0.33552758954501455;Fachkraefte;none;none;none;none;none;none;trans;x;none;none;Der trans Optiker hat schlechte Laune, weil er gestresst ist.
4;11;Optikerin;825;f;2;0.6644724104549855;Fachkraefte;none;none;none;none;none;none;trans;x;none;none;Die trans Optikerin hat schlechte Laune, weil sie gestresst ist.
5;38;Optiker;825;m;1;nan;Fachkraefte;Date;romantic;n;4;nan;none;none;none;none;none;Der Optiker küsst sein Date.
5;38;Optikerin;825;f;1;nan;Fachkraefte;Date;romantic;n;4;nan;none;none;none;none;none;Die Optikerin küsst ihr Date.
6;48;Optiker;825;m;5;nan;Fachkraefte;none;none;none;none;none;none;none;none;Lou;n;Seit Jahren arbeitet Lou als Optiker.
6;48;Optikerin;825;f;5;nan;Fachkraefte;none;none;none;none;none;none;none;none;Lou;n;Seit Jahren arbeitet Lou als Optikerin.
6;48;Optiker;825;m;5;nan;Fachkraefte;none;none;none;none;none;none;none;none;Kayra;n;Seit Jahren arbeitet Kayra als Optiker.
6;48;Optikerin;825;f;5;nan;Fachkraefte;none;none;none;none;none;none;none;none;Kayra;n;Seit Jahren arbeitet Kayra als Optikerin.
1;5;Hörakustiker;825;m;1;0.33552758954501455;Fachkraefte;none;none;none;none;none;none;none;none;none;none;Der Hörakustiker ärgert sich über einen gemachten Fehler.
1;5;Hörakustikerin;825;f;1;0.6644724104549855;Fachkraefte;none;none;none;none;none;none;none;none;none;none;Die Hörakustikerin ärgert sich über einen gemachten Fehler.
3;5;Hörakustiker;825;m;2;0.33552758954501455;Fachkraefte;none;none;none;none;none;none;trans;x;none;none;Der trans Hörakustiker ärgert sich über einen gemachten Fehler.
3;5;Hörakustikerin;825;f;2;0.6644724104549855;Fachkraefte;none;none;none;none;none;none;trans;x;none;none;Die trans Hörakustikerin ärgert sich über einen gemachten Fehler.
2;5;Hörakustiker;825;m;1;0.33552758954501455;Fachkraefte;none;none;none;none;none;none;none;none;none;none;Der Hörakustiker ärgert sich darüber, dass er einen Fehler gemacht hat.
2;5;Hörakustikerin;825;f;1;0.6644724104549855;Fachkraefte;none;none;none;none;none;none;none;none;none;none;Die Hörakustikerin ärgert sich darüber, dass sie einen Fehler gemacht hat.
4;5;Hörakustiker;825;m;2;0.33552758954501455;Fachkraefte;none;none;none;none;none;none;trans;x;none;none;Der trans Hörakustiker ärgert sich darüber, dass er einen Fehler gemacht hat.
4;5;Hörakustikerin;825;f;2;0.6644724104549855;Fachkraefte;none;none;none;none;none;none;trans;x;none;none;Die trans Hörakustikerin ärgert sich darüber, dass sie einen Fehler gemacht hat.
5;42;Hörakustiker;825;m;1;nan;Fachkraefte;Ehemann;romantic;m;4;nan;none;none;none;none;none;Der Hörakustiker zieht seinen Ehemann nah zu sich und sie küssen sich leidenschaftlich.
5;42;Hörakustiker;825;m;1;nan;Fachkraefte;Ehefrau;romantic;f;4;nan;none;none;none;none;none;Der Hörakustiker zieht seine Ehefrau nah zu sich und sie küssen sich leidenschaftlich.
5;42;Hörakustikerin;825;f;1;nan;Fachkraefte;Ehemann;romantic;m;4;nan;none;none;none;none;none;Die Hörakustikerin zieht ihren Ehemann nah zu sich und sie küssen sich leidenschaftlich.
5;42;Hörakustikerin;825;f;1;nan;Fachkraefte;Ehefrau;romantic;f;4;nan;none;none;none;none;none;Die Hörakustikerin zieht ihre Ehefrau nah zu sich und sie küssen sich leidenschaftlich.
6;45;Hörakustiker;825;m;3;nan;Fachkraefte;none;none;none;none;none;none;none;none;Kayra;n;Kayra wurde kürzlich Hörakustiker.
6;45;Hörakustikerin;825;f;3;nan;Fachkraefte;none;none;none;none;none;none;none;none;Kayra;n;Kayra wurde kürzlich Hörakustikerin.
6;45;Hörakustikerin;825;f;3;nan;Fachkraefte;none;none;none;none;none;none;none;none;Emma;f;Emma wurde kürzlich Hörakustikerin.
2;1;Medizintechniker;825;m;1;0.6006423982869379;Spezialisten;none;none;none;none;none;none;none;none;none;none;Der Medizintechniker liebt seine Arbeit.
2;1;Medizintechnikerin;825;f;1;0.3993576017130621;Spezialisten;none;none;none;none;none;none;none;none;none;none;Die Medizintechnikerin liebt ihre Arbeit.
