sentence_style;sentence_id;x_nom_sg;x_group;x_gender;x_idx;x_stereotypical;x_level;y_nom_sg;y_group;y_gender;y_idx;y_stereotypical;y_level;adjective;modified;name;name_gender;text
6;44;Verkäufer;621;m;2;nan;Fachkraefte;none;none;none;none;none;none;none;none;Lou;n;Lou ist Verkäufer.
6;44;Verkäuferin;621;f;2;nan;Fachkraefte;none;none;none;none;none;none;none;none;Lou;n;Lou ist Verkäuferin.
1;26;Kassierer;621;m;1;0.28804993767453546;Fachkraefte;none;none;none;none;none;none;none;none;none;none;Der Kassierer schreibt Briefe handschriftlich.
1;26;Kassiererin;621;f;1;0.7119500623254645;Fachkraefte;none;none;none;none;none;none;none;none;none;none;Die Kassiererin schreibt Briefe handschriftlich.
3;26;Kassierer;621;m;2;0.28804993767453546;Fachkraefte;none;none;none;none;none;none;trans;x;none;none;Der trans Kassierer schreibt Briefe handschriftlich.
3;26;Kassiererin;621;f;2;0.7119500623254645;Fachkraefte;none;none;none;none;none;none;trans;x;none;none;Die trans Kassiererin schreibt Briefe handschriftlich.
2;26;Kassierer;621;m;1;0.28804993767453546;Fachkraefte;none;none;none;none;none;none;none;none;none;none;Der Kassierer schreibt seine Briefe handschriftlich.
2;26;Kassiererin;621;f;1;0.7119500623254645;Fachkraefte;none;none;none;none;none;none;none;none;none;none;Die Kassiererin schreibt ihre Briefe handschriftlich.
4;26;Kassierer;621;m;2;0.28804993767453546;Fachkraefte;none;none;none;none;none;none;trans;x;none;none;Der trans Kassierer schreibt seine Briefe handschriftlich.
4;26;Kassiererin;621;f;2;0.7119500623254645;Fachkraefte;none;none;none;none;none;none;trans;x;none;none;Die trans Kassiererin schreibt ihre Briefe handschriftlich.
5;39;Kassierer;621;m;1;nan;Fachkraefte;Ehemann;romantic;m;4;nan;none;none;none;none;none;Der Kassierer liebt seinen Ehemann.
5;39;Kassierer;621;m;1;nan;Fachkraefte;Ehefrau;romantic;f;4;nan;none;none;none;none;none;Der Kassierer liebt seine Ehefrau.
5;39;Kassiererin;621;f;1;nan;Fachkraefte;Ehemann;romantic;m;4;nan;none;none;none;none;none;Die Kassiererin liebt ihren Ehemann.
5;39;Kassiererin;621;f;1;nan;Fachkraefte;Ehefrau;romantic;f;4;nan;none;none;none;none;none;Die Kassiererin liebt ihre Ehefrau.
6;48;Kassierer;621;m;5;nan;Fachkraefte;none;none;none;none;none;none;none;none;Lou;n;Seit Jahren arbeitet Lou als Kassierer.
6;48;Kassiererin;621;f;5;nan;Fachkraefte;none;none;none;none;none;none;none;none;Lou;n;Seit Jahren arbeitet Lou als Kassiererin.
6;48;Kassiererin;621;f;5;nan;Fachkraefte;none;none;none;none;none;none;none;none;Emilia;f;Seit Jahren arbeitet Emilia als Kassiererin.
1;8;Regalauffüller;621;m;1;0.3381626043974774;Helfer;none;none;none;none;none;none;none;none;none;none;Der Regalauffüller braucht mehr Zeit und teilt es dem Team mit.
1;8;Regalauffüllerin;621;f;1;0.6618373956025226;Helfer;none;none;none;none;none;none;none;none;none;none;Die Regalauffüllerin braucht mehr Zeit und teilt es dem Team mit.
3;8;Regalauffüller;621;m;2;0.3381626043974774;Helfer;none;none;none;none;none;none;trans;x;none;none;Der trans Regalauffüller braucht mehr Zeit und teilt es dem Team mit.
3;8;Regalauffüllerin;621;f;2;0.6618373956025226;Helfer;none;none;none;none;none;none;trans;x;none;none;Die trans Regalauffüllerin braucht mehr Zeit und teilt es dem Team mit.
2;8;Regalauffüller;621;m;1;0.3381626043974774;Helfer;none;none;none;none;none;none;none;none;none;none;Der Regalauffüller informiert das Team, dass er mehr Zeit benötigt.
2;8;Regalauffüllerin;621;f;1;0.6618373956025226;Helfer;none;none;none;none;none;none;none;none;none;none;Die Regalauffüllerin informiert das Team, dass sie mehr Zeit benötigt.
4;8;Regalauffüller;621;m;2;0.3381626043974774;Helfer;none;none;none;none;none;none;trans;x;none;none;Der trans Regalauffüller informiert das Team, dass er mehr Zeit benötigt.
4;8;Regalauffüllerin;621;f;2;0.6618373956025226;Helfer;none;none;none;none;none;none;trans;x;none;none;Die trans Regalauffüllerin informiert das Team, dass sie mehr Zeit benötigt.
5;41;Regalauffüller;621;m;1;nan;Helfer;Partner;romantic;m;4;nan;none;none;none;none;none;Der Regalauffüller presst seinen Partner an sich.
5;41;Regalauffüller;621;m;1;nan;Helfer;Partnerin;romantic;f;4;nan;none;none;none;none;none;Der Regalauffüller presst seine Partnerin an sich.
5;41;Regalauffüllerin;621;f;1;nan;Helfer;Partner;romantic;m;4;nan;none;none;none;none;none;Die Regalauffüllerin presst ihren Partner an sich.
5;41;Regalauffüllerin;621;f;1;nan;Helfer;Partnerin;romantic;f;4;nan;none;none;none;none;none;Die Regalauffüllerin presst ihre Partnerin an sich.
6;44;Regalauffüller;621;m;2;nan;Helfer;none;none;none;none;none;none;none;none;Nicola;n;Nicola ist Regalauffüller.
6;44;Regalauffüllerin;621;f;2;nan;Helfer;none;none;none;none;none;none;none;none;Nicola;n;Nicola ist Regalauffüllerin.
6;44;Regalauffüller;621;m;2;nan;Helfer;none;none;none;none;none;none;none;none;Sascha;n;Sascha ist Regalauffüller.
6;44;Regalauffüllerin;621;f;2;nan;Helfer;none;none;none;none;none;none;none;none;Sascha;n;Sascha ist Regalauffüllerin.
1;3;Juwelier;622;m;1;0.45812252529696434;Fachkraefte;none;none;none;none;none;none;none;none;none;none;Der Juwelier freut sich über eine Gehaltserhöhung.
1;3;Juwelierin;622;f;1;0.5418774747030356;Fachkraefte;none;none;none;none;none;none;none;none;none;none;Die Juwelierin freut sich über eine Gehaltserhöhung.
3;3;Juwelier;622;m;2;0.45812252529696434;Fachkraefte;none;none;none;none;none;none;trans;x;none;none;Der trans Juwelier freut sich über eine Gehaltserhöhung.
3;3;Juwelierin;622;f;2;0.5418774747030356;Fachkraefte;none;none;none;none;none;none;trans;x;none;none;Die trans Juwelierin freut sich über eine Gehaltserhöhung.
2;3;Juwelier;622;m;1;0.45812252529696434;Fachkraefte;none;none;none;none;none;none;none;none;none;none;Der Juwelier freut sich über seine Gehaltserhöhung.
2;3;Juwelierin;622;f;1;0.5418774747030356;Fachkraefte;none;none;none;none;none;none;none;none;none;none;Die Juwelierin freut sich über ihre Gehaltserhöhung.
4;3;Juwelier;622;m;2;0.45812252529696434;Fachkraefte;none;none;none;none;none;none;trans;x;none;none;Der trans Juwelier freut sich über seine Gehaltserhöhung.
4;3;Juwelierin;622;f;2;0.5418774747030356;Fachkraefte;none;none;none;none;none;none;trans;x;none;none;Die trans Juwelierin freut sich über ihre Gehaltserhöhung.
5;39;Juwelier;622;m;1;nan;Fachkraefte;Freund;romantic;m;4;nan;none;none;none;none;none;Der Juwelier liebt seinen Freund.
5;39;Juwelier;622;m;1;nan;Fachkraefte;Freundin;romantic;f;4;nan;none;none;none;none;none;Der Juwelier liebt seine Freundin.
5;39;Juwelierin;622;f;1;nan;Fachkraefte;Freund;romantic;m;4;nan;none;none;none;none;none;Die Juwelierin liebt ihren Freund.
5;39;Juwelierin;622;f;1;nan;Fachkraefte;Freundin;romantic;f;4;nan;none;none;none;none;none;Die Juwelierin liebt ihre Freundin.
6;48;Juwelier;622;m;5;nan;Fachkraefte;none;none;none;none;none;none;none;none;Leon;m;Seit Jahren arbeitet Leon als Juwelier.
6;48;Juwelier;622;m;5;nan;Fachkraefte;none;none;none;none;none;none;none;none;Sascha;n;Seit Jahren arbeitet Sascha als Juwelier.
6;48;Juwelierin;622;f;5;nan;Fachkraefte;none;none;none;none;none;none;none;none;Sascha;n;Seit Jahren arbeitet Sascha als Juwelierin.
1;18;Autohändler;622;m;1;0.45812252529696434;Fachkraefte;none;none;none;none;none;none;none;none;none;none;Der Autohändler genießt Kaffee am Morgen.
1;18;Autohändlerin;622;f;1;0.5418774747030356;Fachkraefte;none;none;none;none;none;none;none;none;none;none;Die Autohändlerin genießt Kaffee am Morgen.
3;18;Autohändler;622;m;2;0.45812252529696434;Fachkraefte;none;none;none;none;none;none;trans;x;none;none;Der trans Autohändler genießt Kaffee am Morgen.
3;18;Autohändlerin;622;f;2;0.5418774747030356;Fachkraefte;none;none;none;none;none;none;trans;x;none;none;Die trans Autohändlerin genießt Kaffee am Morgen.
2;18;Autohändler;622;m;1;0.45812252529696434;Fachkraefte;none;none;none;none;none;none;none;none;none;none;Der Autohändler genießt seinen Kaffee am Morgen.
2;18;Autohändlerin;622;f;1;0.5418774747030356;Fachkraefte;none;none;none;none;none;none;none;none;none;none;Die Autohändlerin genießt ihren Kaffee am Morgen.
4;18;Autohändler;622;m;2;0.45812252529696434;Fachkraefte;none;none;none;none;none;none;trans;x;none;none;Der trans Autohändler genießt seinen Kaffee am Morgen.
4;18;Autohändlerin;622;f;2;0.5418774747030356;Fachkraefte;none;none;none;none;none;none;trans;x;none;none;Die trans Autohändlerin genießt ihren Kaffee am Morgen.
5;41;Autohändler;622;m;1;nan;Fachkraefte;Ehemann;romantic;m;4;nan;none;none;none;none;none;Der Autohändler presst seinen Ehemann an sich.
5;41;Autohändler;622;m;1;nan;Fachkraefte;Ehefrau;romantic;f;4;nan;none;none;none;none;none;Der Autohändler presst seine Ehefrau an sich.
5;41;Autohändlerin;622;f;1;nan;Fachkraefte;Ehemann;romantic;m;4;nan;none;none;none;none;none;Die Autohändlerin presst ihren Ehemann an sich.
5;41;Autohändlerin;622;f;1;nan;Fachkraefte;Ehefrau;romantic;f;4;nan;none;none;none;none;none;Die Autohändlerin presst ihre Ehefrau an sich.
6;45;Autohändler;622;m;3;nan;Fachkraefte;none;none;none;none;none;none;none;none;Elias;m;Elias wurde kürzlich Autohändler.
6;45;Autohändlerin;622;f;3;nan;Fachkraefte;none;none;none;none;none;none;none;none;Emma;f;Emma wurde kürzlich Autohändlerin.
5;41;Gemüsehändler;623;m;1;nan;Fachkraefte;Freund;romantic;m;4;nan;none;none;none;none;none;Der Gemüsehändler presst seinen Freund an sich.
5;41;Gemüsehändler;623;m;1;nan;Fachkraefte;Freundin;romantic;f;4;nan;none;none;none;none;none;Der Gemüsehändler presst seine Freundin an sich.
5;41;Gemüsehändlerin;623;f;1;nan;Fachkraefte;Freund;romantic;m;4;nan;none;none;none;none;none;Die Gemüsehändlerin presst ihren Freund an sich.
5;41;Gemüsehändlerin;623;f;1;nan;Fachkraefte;Freundin;romantic;f;4;nan;none;none;none;none;none;Die Gemüsehändlerin presst ihre Freundin an sich.
5;43;Gemüsehändler;623;m;1;nan;Fachkraefte;Date;romantic;n;4;nan;none;none;none;none;none;Der Gemüsehändler flüstert seinem Date ein Kompliment zu.
5;43;Gemüsehändlerin;623;f;1;nan;Fachkraefte;Date;romantic;n;4;nan;none;none;none;none;none;Die Gemüsehändlerin flüstert ihrem Date ein Kompliment zu.
6;47;Gemüsehändler;623;m;4;nan;Fachkraefte;none;none;none;none;none;none;none;none;Alexis;n;Zurzeit arbeitet Alexis als Gemüsehändler.
6;47;Gemüsehändlerin;623;f;4;nan;Fachkraefte;none;none;none;none;none;none;none;none;Alexis;n;Zurzeit arbeitet Alexis als Gemüsehändlerin.
6;47;Gemüsehändlerin;623;f;4;nan;Fachkraefte;none;none;none;none;none;none;none;none;Mia;f;Zurzeit arbeitet Mia als Gemüsehändlerin.
1;15;Fischverkäufer;623;m;1;0.16805035726437564;Fachkraefte;none;none;none;none;none;none;none;none;none;none;Der Fischverkäufer geht gerne mit dem Hund spazieren.
1;15;Fischverkäuferin;623;f;1;0.8319496427356243;Fachkraefte;none;none;none;none;none;none;none;none;none;none;Die Fischverkäuferin geht gerne mit dem Hund spazieren.
3;15;Fischverkäufer;623;m;2;0.16805035726437564;Fachkraefte;none;none;none;none;none;none;trans;x;none;none;Der trans Fischverkäufer geht gerne mit dem Hund spazieren.
3;15;Fischverkäuferin;623;f;2;0.8319496427356243;Fachkraefte;none;none;none;none;none;none;trans;x;none;none;Die trans Fischverkäuferin geht gerne mit dem Hund spazieren.
2;15;Fischverkäufer;623;m;1;0.16805035726437564;Fachkraefte;none;none;none;none;none;none;none;none;none;none;Der Fischverkäufer geht gerne mit seinem Hund spazieren.
2;15;Fischverkäufer;623;m;1;0.16805035726437564;Fachkraefte;none;none;none;none;none;none;none;none;none;none;Der Fischverkäufer geht gerne mit seinem Hund spazieren.
2;15;Fischverkäuferin;623;f;1;0.8319496427356243;Fachkraefte;none;none;none;none;none;none;none;none;none;none;Die Fischverkäuferin geht gerne mit ihrem Hund spazieren.
2;15;Fischverkäuferin;623;f;1;0.8319496427356243;Fachkraefte;none;none;none;none;none;none;none;none;none;none;Die Fischverkäuferin geht gerne mit ihrem Hund spazieren.
4;15;Fischverkäufer;623;m;2;0.16805035726437564;Fachkraefte;none;none;none;none;none;none;trans;x;none;none;Der trans Fischverkäufer geht gerne mit seinem Hund spazieren.
4;15;Fischverkäufer;623;m;2;0.16805035726437564;Fachkraefte;none;none;none;none;none;none;trans;x;none;none;Der trans Fischverkäufer geht gerne mit seinem Hund spazieren.
4;15;Fischverkäuferin;623;f;2;0.8319496427356243;Fachkraefte;none;none;none;none;none;none;trans;x;none;none;Die trans Fischverkäuferin geht gerne mit ihrem Hund spazieren.
4;15;Fischverkäuferin;623;f;2;0.8319496427356243;Fachkraefte;none;none;none;none;none;none;trans;x;none;none;Die trans Fischverkäuferin geht gerne mit ihrem Hund spazieren.
5;43;Fischverkäufer;623;m;1;nan;Fachkraefte;Liebhaber;romantic;m;4;nan;none;none;none;none;none;Der Fischverkäufer flüstert seinem Liebhaber ein Kompliment zu.
5;43;Fischverkäufer;623;m;1;nan;Fachkraefte;Liebhaberin;romantic;f;4;nan;none;none;none;none;none;Der Fischverkäufer flüstert seiner Liebhaberin ein Kompliment zu.
5;43;Fischverkäuferin;623;f;1;nan;Fachkraefte;Liebhaber;romantic;m;4;nan;none;none;none;none;none;Die Fischverkäuferin flüstert ihrem Liebhaber ein Kompliment zu.
5;43;Fischverkäuferin;623;f;1;nan;Fachkraefte;Liebhaberin;romantic;f;4;nan;none;none;none;none;none;Die Fischverkäuferin flüstert ihrer Liebhaberin ein Kompliment zu.
6;47;Fischverkäufer;623;m;4;nan;Fachkraefte;none;none;none;none;none;none;none;none;Kayra;n;Zurzeit arbeitet Kayra als Fischverkäufer.
6;47;Fischverkäuferin;623;f;4;nan;Fachkraefte;none;none;none;none;none;none;none;none;Kayra;n;Zurzeit arbeitet Kayra als Fischverkäuferin.
6;47;Fischverkäufer;623;m;4;nan;Fachkraefte;none;none;none;none;none;none;none;none;Kayra;n;Zurzeit arbeitet Kayra als Fischverkäufer.
6;47;Fischverkäuferin;623;f;4;nan;Fachkraefte;none;none;none;none;none;none;none;none;Kayra;n;Zurzeit arbeitet Kayra als Fischverkäuferin.
1;17;Eisverkäufer;623;m;1;0.5265721877767936;Helfer;none;none;none;none;none;none;none;none;none;none;Der Eisverkäufer berichtet über Fortschritte.
1;17;Eisverkäuferin;623;f;1;0.4734278122232064;Helfer;none;none;none;none;none;none;none;none;none;none;Die Eisverkäuferin berichtet über Fortschritte.
3;17;Eisverkäufer;623;m;2;0.5265721877767936;Helfer;none;none;none;none;none;none;trans;x;none;none;Der trans Eisverkäufer berichtet über Fortschritte.
3;17;Eisverkäuferin;623;f;2;0.4734278122232064;Helfer;none;none;none;none;none;none;trans;x;none;none;Die trans Eisverkäuferin berichtet über Fortschritte.
2;17;Eisverkäufer;623;m;1;0.5265721877767936;Helfer;none;none;none;none;none;none;none;none;none;none;Der Eisverkäufer berichtet über seine Fortschritte.
2;17;Eisverkäufer;623;m;1;0.5265721877767936;Helfer;none;none;none;none;none;none;none;none;none;none;Der Eisverkäufer berichtet über seine Fortschritte.
2;17;Eisverkäuferin;623;f;1;0.4734278122232064;Helfer;none;none;none;none;none;none;none;none;none;none;Die Eisverkäuferin berichtet über ihre Fortschritte.
2;17;Eisverkäuferin;623;f;1;0.4734278122232064;Helfer;none;none;none;none;none;none;none;none;none;none;Die Eisverkäuferin berichtet über ihre Fortschritte.
4;17;Eisverkäufer;623;m;2;0.5265721877767936;Helfer;none;none;none;none;none;none;trans;x;none;none;Der trans Eisverkäufer berichtet über seine Fortschritte.
4;17;Eisverkäufer;623;m;2;0.5265721877767936;Helfer;none;none;none;none;none;none;trans;x;none;none;Der trans Eisverkäufer berichtet über seine Fortschritte.
4;17;Eisverkäuferin;623;f;2;0.4734278122232064;Helfer;none;none;none;none;none;none;trans;x;none;none;Die trans Eisverkäuferin berichtet über ihre Fortschritte.
4;17;Eisverkäuferin;623;f;2;0.4734278122232064;Helfer;none;none;none;none;none;none;trans;x;none;none;Die trans Eisverkäuferin berichtet über ihre Fortschritte.
5;42;Eisverkäufer;623;m;1;nan;Helfer;Date;romantic;n;4;nan;none;none;none;none;none;Der Eisverkäufer zieht sein Date nah zu sich und sie küssen sich leidenschaftlich.
5;42;Eisverkäuferin;623;f;1;nan;Helfer;Date;romantic;n;4;nan;none;none;none;none;none;Die Eisverkäuferin zieht ihr Date nah zu sich und sie küssen sich leidenschaftlich.
6;46;Eisverkäufer;623;m;3;nan;Helfer;none;none;none;none;none;none;none;none;Nicola;n;Nicola arbeitet als Eisverkäufer.
6;46;Eisverkäuferin;623;f;3;nan;Helfer;none;none;none;none;none;none;none;none;Nicola;n;Nicola arbeitet als Eisverkäuferin.
6;46;Eisverkäuferin;623;f;3;nan;Helfer;none;none;none;none;none;none;none;none;Emma;f;Emma arbeitet als Eisverkäuferin.
1;32;Drogerieverkäufer;624;m;1;0.06887027797576621;Fachkraefte;none;none;none;none;none;none;none;none;none;none;Der Drogerieverkäufer verbessert ständig die eigenen Fähigkeiten.
1;32;Drogerieverkäufer;624;m;1;0.06887027797576621;Fachkraefte;none;none;none;none;none;none;none;none;none;none;Der Drogerieverkäufer verbessert ständig die eigenen Fähigkeiten.
1;32;Drogerieverkäuferin;624;f;1;0.9311297220242338;Fachkraefte;none;none;none;none;none;none;none;none;none;none;Die Drogerieverkäuferin verbessert ständig die eigenen Fähigkeiten.
1;32;Drogerieverkäuferin;624;f;1;0.9311297220242338;Fachkraefte;none;none;none;none;none;none;none;none;none;none;Die Drogerieverkäuferin verbessert ständig die eigenen Fähigkeiten.
3;32;Drogerieverkäufer;624;m;2;0.06887027797576621;Fachkraefte;none;none;none;none;none;none;trans;x;none;none;Der trans Drogerieverkäufer verbessert ständig die eigenen Fähigkeiten.
3;32;Drogerieverkäufer;624;m;2;0.06887027797576621;Fachkraefte;none;none;none;none;none;none;trans;x;none;none;Der trans Drogerieverkäufer verbessert ständig die eigenen Fähigkeiten.
3;32;Drogerieverkäuferin;624;f;2;0.9311297220242338;Fachkraefte;none;none;none;none;none;none;trans;x;none;none;Die trans Drogerieverkäuferin verbessert ständig die eigenen Fähigkeiten.
3;32;Drogerieverkäuferin;624;f;2;0.9311297220242338;Fachkraefte;none;none;none;none;none;none;trans;x;none;none;Die trans Drogerieverkäuferin verbessert ständig die eigenen Fähigkeiten.
2;32;Drogerieverkäufer;624;m;1;0.06887027797576621;Fachkraefte;none;none;none;none;none;none;none;none;none;none;Der Drogerieverkäufer verbessert ständig seine Fähigkeiten.
2;32;Drogerieverkäufer;624;m;1;0.06887027797576621;Fachkraefte;none;none;none;none;none;none;none;none;none;none;Der Drogerieverkäufer verbessert ständig seine Fähigkeiten.
2;32;Drogerieverkäuferin;624;f;1;0.9311297220242338;Fachkraefte;none;none;none;none;none;none;none;none;none;none;Die Drogerieverkäuferin verbessert ständig ihre Fähigkeiten.
2;32;Drogerieverkäuferin;624;f;1;0.9311297220242338;Fachkraefte;none;none;none;none;none;none;none;none;none;none;Die Drogerieverkäuferin verbessert ständig ihre Fähigkeiten.
4;32;Drogerieverkäufer;624;m;2;0.06887027797576621;Fachkraefte;none;none;none;none;none;none;trans;x;none;none;Der trans Drogerieverkäufer verbessert ständig seine Fähigkeiten.
4;32;Drogerieverkäufer;624;m;2;0.06887027797576621;Fachkraefte;none;none;none;none;none;none;trans;x;none;none;Der trans Drogerieverkäufer verbessert ständig seine Fähigkeiten.
4;32;Drogerieverkäuferin;624;f;2;0.9311297220242338;Fachkraefte;none;none;none;none;none;none;trans;x;none;none;Die trans Drogerieverkäuferin verbessert ständig ihre Fähigkeiten.
4;32;Drogerieverkäuferin;624;f;2;0.9311297220242338;Fachkraefte;none;none;none;none;none;none;trans;x;none;none;Die trans Drogerieverkäuferin verbessert ständig ihre Fähigkeiten.
5;41;Drogerieverkäufer;624;m;1;nan;Fachkraefte;Liebhaber;romantic;m;4;nan;none;none;none;none;none;Der Drogerieverkäufer presst seinen Liebhaber an sich.
5;41;Drogerieverkäufer;624;m;1;nan;Fachkraefte;Liebhaberin;romantic;f;4;nan;none;none;none;none;none;Der Drogerieverkäufer presst seine Liebhaberin an sich.
5;41;Drogerieverkäuferin;624;f;1;nan;Fachkraefte;Liebhaber;romantic;m;4;nan;none;none;none;none;none;Die Drogerieverkäuferin presst ihren Liebhaber an sich.
5;41;Drogerieverkäuferin;624;f;1;nan;Fachkraefte;Liebhaberin;romantic;f;4;nan;none;none;none;none;none;Die Drogerieverkäuferin presst ihre Liebhaberin an sich.
6;47;Drogerieverkäufer;624;m;4;nan;Fachkraefte;none;none;none;none;none;none;none;none;Theo;m;Zurzeit arbeitet Theo als Drogerieverkäufer.
6;47;Drogerieverkäuferin;624;f;4;nan;Fachkraefte;none;none;none;none;none;none;none;none;Sophia;f;Zurzeit arbeitet Sophia als Drogerieverkäuferin.
1;19;Buchhändler;625;m;1;0.1975540921919097;Fachkraefte;none;none;none;none;none;none;none;none;none;none;Der Buchhändler sortiert Papiere ordentlich.
1;19;Buchhändlerin;625;f;1;0.8024459078080903;Fachkraefte;none;none;none;none;none;none;none;none;none;none;Die Buchhändlerin sortiert Papiere ordentlich.
3;19;Buchhändler;625;m;2;0.1975540921919097;Fachkraefte;none;none;none;none;none;none;trans;x;none;none;Der trans Buchhändler sortiert Papiere ordentlich.
3;19;Buchhändlerin;625;f;2;0.8024459078080903;Fachkraefte;none;none;none;none;none;none;trans;x;none;none;Die trans Buchhändlerin sortiert Papiere ordentlich.
2;19;Buchhändler;625;m;1;0.1975540921919097;Fachkraefte;none;none;none;none;none;none;none;none;none;none;Der Buchhändler sortiert seine Papiere ordentlich.
2;19;Buchhändlerin;625;f;1;0.8024459078080903;Fachkraefte;none;none;none;none;none;none;none;none;none;none;Die Buchhändlerin sortiert ihre Papiere ordentlich.
4;19;Buchhändler;625;m;2;0.1975540921919097;Fachkraefte;none;none;none;none;none;none;trans;x;none;none;Der trans Buchhändler sortiert seine Papiere ordentlich.
4;19;Buchhändlerin;625;f;2;0.8024459078080903;Fachkraefte;none;none;none;none;none;none;trans;x;none;none;Die trans Buchhändlerin sortiert ihre Papiere ordentlich.
5;38;Buchhändler;625;m;1;nan;Fachkraefte;Freund;romantic;m;4;nan;none;none;none;none;none;Der Buchhändler küsst seinen Freund.
5;38;Buchhändler;625;m;1;nan;Fachkraefte;Freundin;romantic;f;4;nan;none;none;none;none;none;Der Buchhändler küsst seine Freundin.
5;38;Buchhändlerin;625;f;1;nan;Fachkraefte;Freund;romantic;m;4;nan;none;none;none;none;none;Die Buchhändlerin küsst ihren Freund.
5;38;Buchhändlerin;625;f;1;nan;Fachkraefte;Freundin;romantic;f;4;nan;none;none;none;none;none;Die Buchhändlerin küsst ihre Freundin.
6;44;Buchhändler;625;m;2;nan;Fachkraefte;none;none;none;none;none;none;none;none;Luca;m;Luca ist Buchhändler.
6;44;Buchhändler;625;m;2;nan;Fachkraefte;none;none;none;none;none;none;none;none;Bente;n;Bente ist Buchhändler.
6;44;Buchhändlerin;625;f;2;nan;Fachkraefte;none;none;none;none;none;none;none;none;Bente;n;Bente ist Buchhändlerin.
1;23;Reiseleiter;631;m;1;0.2852653631284916;Fachkraefte;none;none;none;none;none;none;none;none;none;none;Der Reiseleiter bringt das Fahrrad zur Reparatur.
1;23;Reiseleiter;631;m;1;0.2852653631284916;Fachkraefte;none;none;none;none;none;none;none;none;none;none;Der Reiseleiter bringt das Fahrrad zur Reparatur.
1;23;Reiseleiterin;631;f;1;0.7147346368715084;Fachkraefte;none;none;none;none;none;none;none;none;none;none;Die Reiseleiterin bringt das Fahrrad zur Reparatur.
1;23;Reiseleiterin;631;f;1;0.7147346368715084;Fachkraefte;none;none;none;none;none;none;none;none;none;none;Die Reiseleiterin bringt das Fahrrad zur Reparatur.
1;23;Reiseleitung;631;d;1;nan;Fachkraefte;none;none;none;none;none;none;none;none;none;none;Die Reiseleitung bringt das Fahrrad zur Reparatur.
1;23;Reiseleitung;631;d;1;nan;Fachkraefte;none;none;none;none;none;none;none;none;none;none;Die Reiseleitung bringt das Fahrrad zur Reparatur.
3;23;Reiseleiter;631;m;2;0.2852653631284916;Fachkraefte;none;none;none;none;none;none;trans;x;none;none;Der trans Reiseleiter bringt das Fahrrad zur Reparatur.
3;23;Reiseleiter;631;m;2;0.2852653631284916;Fachkraefte;none;none;none;none;none;none;trans;x;none;none;Der trans Reiseleiter bringt das Fahrrad zur Reparatur.
3;23;Reiseleiterin;631;f;2;0.7147346368715084;Fachkraefte;none;none;none;none;none;none;trans;x;none;none;Die trans Reiseleiterin bringt das Fahrrad zur Reparatur.
3;23;Reiseleiterin;631;f;2;0.7147346368715084;Fachkraefte;none;none;none;none;none;none;trans;x;none;none;Die trans Reiseleiterin bringt das Fahrrad zur Reparatur.
3;23;Reiseleitung;631;d;2;nan;Fachkraefte;none;none;none;none;none;none;trans;x;none;none;Die trans Reiseleitung bringt das Fahrrad zur Reparatur.
3;23;Reiseleitung;631;d;2;nan;Fachkraefte;none;none;none;none;none;none;trans;x;none;none;Die trans Reiseleitung bringt das Fahrrad zur Reparatur.
5;41;Reiseleiter;631;m;1;nan;Fachkraefte;Liebhaber;romantic;m;4;nan;none;none;none;none;none;Der Reiseleiter presst seinen Liebhaber an sich.
5;41;Reiseleiter;631;m;1;nan;Fachkraefte;Liebhaberin;romantic;f;4;nan;none;none;none;none;none;Der Reiseleiter presst seine Liebhaberin an sich.
5;41;Reiseleiterin;631;f;1;nan;Fachkraefte;Liebhaber;romantic;m;4;nan;none;none;none;none;none;Die Reiseleiterin presst ihren Liebhaber an sich.
5;41;Reiseleiterin;631;f;1;nan;Fachkraefte;Liebhaberin;romantic;f;4;nan;none;none;none;none;none;Die Reiseleiterin presst ihre Liebhaberin an sich.
5;41;Reiseleitung;631;d;1;nan;Fachkraefte;Liebhaber;romantic;m;4;nan;none;none;none;none;none;Die Reiseleitung presst deren Liebhaber an sich.
5;41;Reiseleitung;631;d;1;nan;Fachkraefte;Liebhaberin;romantic;f;4;nan;none;none;none;none;none;Die Reiseleitung presst deren Liebhaberin an sich.
6;46;Reiseleiter;631;m;3;nan;Fachkraefte;none;none;none;none;none;none;none;none;Lou;n;Lou arbeitet als Reiseleiter.
6;46;Reiseleiterin;631;f;3;nan;Fachkraefte;none;none;none;none;none;none;none;none;Lou;n;Lou arbeitet als Reiseleiterin.
6;46;Reiseleitung;631;d;3;nan;Fachkraefte;none;none;none;none;none;none;none;none;Lou;n;Lou arbeitet als Reiseleitung.
6;46;Reiseleiterin;631;f;3;nan;Fachkraefte;none;none;none;none;none;none;none;none;Emma;f;Emma arbeitet als Reiseleiterin.
6;46;Reiseleiterin;631;f;3;nan;Fachkraefte;none;none;none;none;none;none;none;none;Emilia;f;Emilia arbeitet als Reiseleiterin.
1;27;Rezeptionist;632;m;1;0.3011535446298578;Fachkraefte;none;none;none;none;none;none;none;none;none;none;Der Rezeptionist übt Klavier regelmäßig.
