sentence_style;sentence_id;x_nom_sg;x_group;x_gender;x_idx;x_stereotypical;x_level;y_nom_sg;y_group;y_gender;y_idx;y_stereotypical;y_level;adjective;modified;name;name_gender;text
4;32;Dachdecker;321;m;2;0.9929172200088535;Fachkraefte;none;none;none;none;none;none;trans;x;none;none;Der trans Dachdecker verbessert ständig seine Fähigkeiten.
4;32;Dachdeckerin;321;f;2;0.007082779991146525;Fachkraefte;none;none;none;none;none;none;trans;x;none;none;Die trans Dachdeckerin verbessert ständig ihre Fähigkeiten.
5;40;Dachdecker;321;m;1;nan;Fachkraefte;Freund;romantic;m;4;nan;none;none;none;none;none;Der Dachdecker schreibt seinem Freund einen Liebesbrief.
5;40;Dachdecker;321;m;1;nan;Fachkraefte;Freundin;romantic;f;4;nan;none;none;none;none;none;Der Dachdecker schreibt seiner Freundin einen Liebesbrief.
5;40;Dachdeckerin;321;f;1;nan;Fachkraefte;Freund;romantic;m;4;nan;none;none;none;none;none;Die Dachdeckerin schreibt ihrem Freund einen Liebesbrief.
5;40;Dachdeckerin;321;f;1;nan;Fachkraefte;Freundin;romantic;f;4;nan;none;none;none;none;none;Die Dachdeckerin schreibt ihrer Freundin einen Liebesbrief.
6;47;Dachdecker;321;m;4;nan;Fachkraefte;none;none;none;none;none;none;none;none;Noah;m;Zurzeit arbeitet Noah als Dachdecker.
6;47;Dachdecker;321;m;4;nan;Fachkraefte;none;none;none;none;none;none;none;none;Bente;n;Zurzeit arbeitet Bente als Dachdecker.
6;47;Dachdeckerin;321;f;4;nan;Fachkraefte;none;none;none;none;none;none;none;none;Bente;n;Zurzeit arbeitet Bente als Dachdeckerin.
1;36;Bauarbeiter;321;m;1;0.9885902031063322;Helfer;none;none;none;none;none;none;none;none;none;none;Der Bauarbeiter setzt Prioritäten für die Arbeit.
1;36;Bauarbeiterin;321;f;1;0.011409796893667862;Helfer;none;none;none;none;none;none;none;none;none;none;Die Bauarbeiterin setzt Prioritäten für die Arbeit.
3;36;Bauarbeiter;321;m;2;0.9885902031063322;Helfer;none;none;none;none;none;none;trans;x;none;none;Der trans Bauarbeiter setzt Prioritäten für die Arbeit.
3;36;Bauarbeiterin;321;f;2;0.011409796893667862;Helfer;none;none;none;none;none;none;trans;x;none;none;Die trans Bauarbeiterin setzt Prioritäten für die Arbeit.
2;36;Bauarbeiter;321;m;1;0.9885902031063322;Helfer;none;none;none;none;none;none;none;none;none;none;Der Bauarbeiter setzt Prioritäten für seine Arbeit.
2;36;Bauarbeiterin;321;f;1;0.011409796893667862;Helfer;none;none;none;none;none;none;none;none;none;none;Die Bauarbeiterin setzt Prioritäten für ihre Arbeit.
4;36;Bauarbeiter;321;m;2;0.9885902031063322;Helfer;none;none;none;none;none;none;trans;x;none;none;Der trans Bauarbeiter setzt Prioritäten für seine Arbeit.
4;36;Bauarbeiterin;321;f;2;0.011409796893667862;Helfer;none;none;none;none;none;none;trans;x;none;none;Die trans Bauarbeiterin setzt Prioritäten für ihre Arbeit.
5;43;Bauarbeiter;321;m;1;nan;Helfer;Partner;romantic;m;4;nan;none;none;none;none;none;Der Bauarbeiter flüstert seinem Partner ein Kompliment zu.
5;43;Bauarbeiter;321;m;1;nan;Helfer;Partnerin;romantic;f;4;nan;none;none;none;none;none;Der Bauarbeiter flüstert seiner Partnerin ein Kompliment zu.
5;43;Bauarbeiterin;321;f;1;nan;Helfer;Partner;romantic;m;4;nan;none;none;none;none;none;Die Bauarbeiterin flüstert ihrem Partner ein Kompliment zu.
5;43;Bauarbeiterin;321;f;1;nan;Helfer;Partnerin;romantic;f;4;nan;none;none;none;none;none;Die Bauarbeiterin flüstert ihrer Partnerin ein Kompliment zu.
6;44;Bauarbeiter;321;m;2;nan;Helfer;none;none;none;none;none;none;none;none;Kayra;n;Kayra ist Bauarbeiter.
6;44;Bauarbeiterin;321;f;2;nan;Helfer;none;none;none;none;none;none;none;none;Kayra;n;Kayra ist Bauarbeiterin.
6;44;Bauarbeiter;321;m;2;nan;Helfer;none;none;none;none;none;none;none;none;Sascha;n;Sascha ist Bauarbeiter.
6;44;Bauarbeiterin;321;f;2;nan;Helfer;none;none;none;none;none;none;none;none;Sascha;n;Sascha ist Bauarbeiterin.
1;12;Kanalbauer;322;m;1;0.9930269102337458;Fachkraefte;none;none;none;none;none;none;none;none;none;none;Der Kanalbauer isst Abendbrot um den Hunger zu stillen.
1;12;Kanalbauerin;322;f;1;0.006973089766254174;Fachkraefte;none;none;none;none;none;none;none;none;none;none;Die Kanalbauerin isst Abendbrot um den Hunger zu stillen.
3;12;Kanalbauer;322;m;2;0.9930269102337458;Fachkraefte;none;none;none;none;none;none;trans;x;none;none;Der trans Kanalbauer isst Abendbrot um den Hunger zu stillen.
3;12;Kanalbauerin;322;f;2;0.006973089766254174;Fachkraefte;none;none;none;none;none;none;trans;x;none;none;Die trans Kanalbauerin isst Abendbrot um den Hunger zu stillen.
2;12;Kanalbauer;322;m;1;0.9930269102337458;Fachkraefte;none;none;none;none;none;none;none;none;none;none;Der Kanalbauer isst Abendbrot, weil er Hunger hat.
2;12;Kanalbauerin;322;f;1;0.006973089766254174;Fachkraefte;none;none;none;none;none;none;none;none;none;none;Die Kanalbauerin isst Abendbrot, weil sie Hunger hat.
4;12;Kanalbauer;322;m;2;0.9930269102337458;Fachkraefte;none;none;none;none;none;none;trans;x;none;none;Der trans Kanalbauer isst Abendbrot, weil er Hunger hat.
4;12;Kanalbauerin;322;f;2;0.006973089766254174;Fachkraefte;none;none;none;none;none;none;trans;x;none;none;Die trans Kanalbauerin isst Abendbrot, weil sie Hunger hat.
5;42;Kanalbauer;322;m;1;nan;Fachkraefte;Liebhaber;romantic;m;4;nan;none;none;none;none;none;Der Kanalbauer zieht seinen Liebhaber nah zu sich und sie küssen sich leidenschaftlich.
5;42;Kanalbauer;322;m;1;nan;Fachkraefte;Liebhaberin;romantic;f;4;nan;none;none;none;none;none;Der Kanalbauer zieht seine Liebhaberin nah zu sich und sie küssen sich leidenschaftlich.
5;42;Kanalbauerin;322;f;1;nan;Fachkraefte;Liebhaber;romantic;m;4;nan;none;none;none;none;none;Die Kanalbauerin zieht ihren Liebhaber nah zu sich und sie küssen sich leidenschaftlich.
5;42;Kanalbauerin;322;f;1;nan;Fachkraefte;Liebhaberin;romantic;f;4;nan;none;none;none;none;none;Die Kanalbauerin zieht ihre Liebhaberin nah zu sich und sie küssen sich leidenschaftlich.
6;44;Kanalbauer;322;m;2;nan;Fachkraefte;none;none;none;none;none;none;none;none;Nicola;n;Nicola ist Kanalbauer.
6;44;Kanalbauerin;322;f;2;nan;Fachkraefte;none;none;none;none;none;none;none;none;Nicola;n;Nicola ist Kanalbauerin.
6;44;Kanalbauer;322;m;2;nan;Fachkraefte;none;none;none;none;none;none;none;none;Alexis;n;Alexis ist Kanalbauer.
6;44;Kanalbauerin;322;f;2;nan;Fachkraefte;none;none;none;none;none;none;none;none;Alexis;n;Alexis ist Kanalbauerin.
1;13;Teerer;322;m;1;0.9837608849140974;Helfer;none;none;none;none;none;none;none;none;none;none;Der Teerer hört gern Musik zum Entspannen.
1;13;Teererin;322;f;1;0.016239115085902565;Helfer;none;none;none;none;none;none;none;none;none;none;Die Teererin hört gern Musik zum Entspannen.
3;13;Teerer;322;m;2;0.9837608849140974;Helfer;none;none;none;none;none;none;trans;x;none;none;Der trans Teerer hört gern Musik zum Entspannen.
3;13;Teererin;322;f;2;0.016239115085902565;Helfer;none;none;none;none;none;none;trans;x;none;none;Die trans Teererin hört gern Musik zum Entspannen.
2;13;Teerer;322;m;1;0.9837608849140974;Helfer;none;none;none;none;none;none;none;none;none;none;Der Teerer hört Musik, wenn er sich entspannen möchte.
2;13;Teererin;322;f;1;0.016239115085902565;Helfer;none;none;none;none;none;none;none;none;none;none;Die Teererin hört Musik, wenn sie sich entspannen möchte.
4;13;Teerer;322;m;2;0.9837608849140974;Helfer;none;none;none;none;none;none;trans;x;none;none;Der trans Teerer hört Musik, wenn er sich entspannen möchte.
4;13;Teererin;322;f;2;0.016239115085902565;Helfer;none;none;none;none;none;none;trans;x;none;none;Die trans Teererin hört Musik, wenn sie sich entspannen möchte.
5;40;Teerer;322;m;1;nan;Helfer;Liebhaber;romantic;m;4;nan;none;none;none;none;none;Der Teerer schreibt seinem Liebhaber einen Liebesbrief.
5;40;Teerer;322;m;1;nan;Helfer;Liebhaberin;romantic;f;4;nan;none;none;none;none;none;Der Teerer schreibt seiner Liebhaberin einen Liebesbrief.
5;40;Teererin;322;f;1;nan;Helfer;Liebhaber;romantic;m;4;nan;none;none;none;none;none;Die Teererin schreibt ihrem Liebhaber einen Liebesbrief.
5;40;Teererin;322;f;1;nan;Helfer;Liebhaberin;romantic;f;4;nan;none;none;none;none;none;Die Teererin schreibt ihrer Liebhaberin einen Liebesbrief.
6;46;Teerer;322;m;3;nan;Helfer;none;none;none;none;none;none;none;none;Alexis;n;Alexis arbeitet als Teerer.
6;46;Teererin;322;f;3;nan;Helfer;none;none;none;none;none;none;none;none;Alexis;n;Alexis arbeitet als Teererin.
6;46;Teerer;322;m;3;nan;Helfer;none;none;none;none;none;none;none;none;Alexis;n;Alexis arbeitet als Teerer.
6;46;Teererin;322;f;3;nan;Helfer;none;none;none;none;none;none;none;none;Alexis;n;Alexis arbeitet als Teererin.
1;3;Fliesenleger;331;m;1;0.9889781859931114;Fachkraefte;none;none;none;none;none;none;none;none;none;none;Der Fliesenleger freut sich über eine Gehaltserhöhung.
1;3;Fliesenlegerin;331;f;1;0.011021814006888633;Fachkraefte;none;none;none;none;none;none;none;none;none;none;Die Fliesenlegerin freut sich über eine Gehaltserhöhung.
3;3;Fliesenleger;331;m;2;0.9889781859931114;Fachkraefte;none;none;none;none;none;none;trans;x;none;none;Der trans Fliesenleger freut sich über eine Gehaltserhöhung.
3;3;Fliesenlegerin;331;f;2;0.011021814006888633;Fachkraefte;none;none;none;none;none;none;trans;x;none;none;Die trans Fliesenlegerin freut sich über eine Gehaltserhöhung.
2;3;Fliesenleger;331;m;1;0.9889781859931114;Fachkraefte;none;none;none;none;none;none;none;none;none;none;Der Fliesenleger freut sich über seine Gehaltserhöhung.
2;3;Fliesenlegerin;331;f;1;0.011021814006888633;Fachkraefte;none;none;none;none;none;none;none;none;none;none;Die Fliesenlegerin freut sich über ihre Gehaltserhöhung.
4;3;Fliesenleger;331;m;2;0.9889781859931114;Fachkraefte;none;none;none;none;none;none;trans;x;none;none;Der trans Fliesenleger freut sich über seine Gehaltserhöhung.
4;3;Fliesenlegerin;331;f;2;0.011021814006888633;Fachkraefte;none;none;none;none;none;none;trans;x;none;none;Die trans Fliesenlegerin freut sich über ihre Gehaltserhöhung.
5;38;Fliesenleger;331;m;1;nan;Fachkraefte;Ehemann;romantic;m;4;nan;none;none;none;none;none;Der Fliesenleger küsst seinen Ehemann.
5;38;Fliesenleger;331;m;1;nan;Fachkraefte;Ehefrau;romantic;f;4;nan;none;none;none;none;none;Der Fliesenleger küsst seine Ehefrau.
5;38;Fliesenlegerin;331;f;1;nan;Fachkraefte;Ehemann;romantic;m;4;nan;none;none;none;none;none;Die Fliesenlegerin küsst ihren Ehemann.
5;38;Fliesenlegerin;331;f;1;nan;Fachkraefte;Ehefrau;romantic;f;4;nan;none;none;none;none;none;Die Fliesenlegerin küsst ihre Ehefrau.
6;46;Fliesenleger;331;m;3;nan;Fachkraefte;none;none;none;none;none;none;none;none;Nicola;n;Nicola arbeitet als Fliesenleger.
6;46;Fliesenlegerin;331;f;3;nan;Fachkraefte;none;none;none;none;none;none;none;none;Nicola;n;Nicola arbeitet als Fliesenlegerin.
6;46;Fliesenleger;331;m;3;nan;Fachkraefte;none;none;none;none;none;none;none;none;Sascha;n;Sascha arbeitet als Fliesenleger.
6;46;Fliesenlegerin;331;f;3;nan;Fachkraefte;none;none;none;none;none;none;none;none;Sascha;n;Sascha arbeitet als Fliesenlegerin.
1;27;Maler;332;m;1;0.9307910750507099;Fachkraefte;none;none;none;none;none;none;none;none;none;none;Der Maler übt Klavier regelmäßig.
1;27;Malerin;332;f;1;0.06920892494929005;Fachkraefte;none;none;none;none;none;none;none;none;none;none;Die Malerin übt Klavier regelmäßig.
3;27;Maler;332;m;2;0.9307910750507099;Fachkraefte;none;none;none;none;none;none;trans;x;none;none;Der trans Maler übt Klavier regelmäßig.
3;27;Malerin;332;f;2;0.06920892494929005;Fachkraefte;none;none;none;none;none;none;trans;x;none;none;Die trans Malerin übt Klavier regelmäßig.
2;27;Maler;332;m;1;0.9307910750507099;Fachkraefte;none;none;none;none;none;none;none;none;none;none;Der Maler übt jeden Tag mit seinem Klavier.
2;27;Malerin;332;f;1;0.06920892494929005;Fachkraefte;none;none;none;none;none;none;none;none;none;none;Die Malerin übt jeden Tag mit ihrem Klavier.
4;27;Maler;332;m;2;0.9307910750507099;Fachkraefte;none;none;none;none;none;none;trans;x;none;none;Der trans Maler übt jeden Tag mit seinem Klavier.
4;27;Malerin;332;f;2;0.06920892494929005;Fachkraefte;none;none;none;none;none;none;trans;x;none;none;Die trans Malerin übt jeden Tag mit ihrem Klavier.
5;41;Maler;332;m;1;nan;Fachkraefte;Ehemann;romantic;m;4;nan;none;none;none;none;none;Der Maler presst seinen Ehemann an sich.
5;41;Maler;332;m;1;nan;Fachkraefte;Ehefrau;romantic;f;4;nan;none;none;none;none;none;Der Maler presst seine Ehefrau an sich.
5;41;Malerin;332;f;1;nan;Fachkraefte;Ehemann;romantic;m;4;nan;none;none;none;none;none;Die Malerin presst ihren Ehemann an sich.
5;41;Malerin;332;f;1;nan;Fachkraefte;Ehefrau;romantic;f;4;nan;none;none;none;none;none;Die Malerin presst ihre Ehefrau an sich.
6;48;Maler;332;m;5;nan;Fachkraefte;none;none;none;none;none;none;none;none;Kayra;n;Seit Jahren arbeitet Kayra als Maler.
6;48;Malerin;332;f;5;nan;Fachkraefte;none;none;none;none;none;none;none;none;Kayra;n;Seit Jahren arbeitet Kayra als Malerin.
6;48;Maler;332;m;5;nan;Fachkraefte;none;none;none;none;none;none;none;none;Kayra;n;Seit Jahren arbeitet Kayra als Maler.
6;48;Malerin;332;f;5;nan;Fachkraefte;none;none;none;none;none;none;none;none;Kayra;n;Seit Jahren arbeitet Kayra als Malerin.
5;42;Malerhelfer;332;m;1;nan;Helfer;Date;romantic;n;4;nan;none;none;none;none;none;Der Malerhelfer zieht sein Date nah zu sich und sie küssen sich leidenschaftlich.
5;42;Malerhelferin;332;f;1;nan;Helfer;Date;romantic;n;4;nan;none;none;none;none;none;Die Malerhelferin zieht ihr Date nah zu sich und sie küssen sich leidenschaftlich.
5;42;Malerhilfe;332;d;1;nan;Helfer;Date;romantic;n;4;nan;none;none;none;none;none;Die Malerhilfe zieht deren Date nah zu sich und sie küssen sich leidenschaftlich.
5;42;Malerhelfer;332;m;1;nan;Helfer;Partner;romantic;m;4;nan;none;none;none;none;none;Der Malerhelfer zieht seinen Partner nah zu sich und sie küssen sich leidenschaftlich.
5;42;Malerhelfer;332;m;1;nan;Helfer;Partnerin;romantic;f;4;nan;none;none;none;none;none;Der Malerhelfer zieht seine Partnerin nah zu sich und sie küssen sich leidenschaftlich.
5;42;Malerhelferin;332;f;1;nan;Helfer;Partner;romantic;m;4;nan;none;none;none;none;none;Die Malerhelferin zieht ihren Partner nah zu sich und sie küssen sich leidenschaftlich.
5;42;Malerhelferin;332;f;1;nan;Helfer;Partnerin;romantic;f;4;nan;none;none;none;none;none;Die Malerhelferin zieht ihre Partnerin nah zu sich und sie küssen sich leidenschaftlich.
5;42;Malerhilfe;332;d;1;nan;Helfer;Partner;romantic;m;4;nan;none;none;none;none;none;Die Malerhilfe zieht deren Partner nah zu sich und sie küssen sich leidenschaftlich.
5;42;Malerhilfe;332;d;1;nan;Helfer;Partnerin;romantic;f;4;nan;none;none;none;none;none;Die Malerhilfe zieht deren Partnerin nah zu sich und sie küssen sich leidenschaftlich.
6;48;Malerhelfer;332;m;5;nan;Helfer;none;none;none;none;none;none;none;none;Luca;m;Seit Jahren arbeitet Luca als Malerhelfer.
6;48;Malerhelferin;332;f;5;nan;Helfer;none;none;none;none;none;none;none;none;Emilia;f;Seit Jahren arbeitet Emilia als Malerhelferin.
6;48;Malerhelfer;332;m;5;nan;Helfer;none;none;none;none;none;none;none;none;Sascha;n;Seit Jahren arbeitet Sascha als Malerhelfer.
6;48;Malerhelferin;332;f;5;nan;Helfer;none;none;none;none;none;none;none;none;Sascha;n;Seit Jahren arbeitet Sascha als Malerhelferin.
6;48;Malerhilfe;332;d;5;nan;Helfer;none;none;none;none;none;none;none;none;Sascha;n;Seit Jahren arbeitet Sascha als Malerhilfe.
1;24;Autoglaser;333;m;1;0.9727347611202636;Fachkraefte;none;none;none;none;none;none;none;none;none;none;Der Autoglaser feiert fröhlich (den eigenen) Geburtstag.
1;24;Autoglaserin;333;f;1;0.02726523887973641;Fachkraefte;none;none;none;none;none;none;none;none;none;none;Die Autoglaserin feiert fröhlich (den eigenen) Geburtstag.
3;24;Autoglaser;333;m;2;0.9727347611202636;Fachkraefte;none;none;none;none;none;none;trans;x;none;none;Der trans Autoglaser feiert fröhlich (den eigenen) Geburtstag.
3;24;Autoglaserin;333;f;2;0.02726523887973641;Fachkraefte;none;none;none;none;none;none;trans;x;none;none;Die trans Autoglaserin feiert fröhlich (den eigenen) Geburtstag.
2;24;Autoglaser;333;m;1;0.9727347611202636;Fachkraefte;none;none;none;none;none;none;none;none;none;none;Der Autoglaser feiert fröhlich seinen Geburtstag.
2;24;Autoglaserin;333;f;1;0.02726523887973641;Fachkraefte;none;none;none;none;none;none;none;none;none;none;Die Autoglaserin feiert fröhlich ihren Geburtstag.
4;24;Autoglaser;333;m;2;0.9727347611202636;Fachkraefte;none;none;none;none;none;none;trans;x;none;none;Der trans Autoglaser feiert fröhlich seinen Geburtstag.
4;24;Autoglaserin;333;f;2;0.02726523887973641;Fachkraefte;none;none;none;none;none;none;trans;x;none;none;Die trans Autoglaserin feiert fröhlich ihren Geburtstag.
5;42;Autoglaser;333;m;1;nan;Fachkraefte;Freund;romantic;m;4;nan;none;none;none;none;none;Der Autoglaser zieht seinen Freund nah zu sich und sie küssen sich leidenschaftlich.
5;42;Autoglaser;333;m;1;nan;Fachkraefte;Freundin;romantic;f;4;nan;none;none;none;none;none;Der Autoglaser zieht seine Freundin nah zu sich und sie küssen sich leidenschaftlich.
5;42;Autoglaserin;333;f;1;nan;Fachkraefte;Freund;romantic;m;4;nan;none;none;none;none;none;Die Autoglaserin zieht ihren Freund nah zu sich und sie küssen sich leidenschaftlich.
5;42;Autoglaserin;333;f;1;nan;Fachkraefte;Freundin;romantic;f;4;nan;none;none;none;none;none;Die Autoglaserin zieht ihre Freundin nah zu sich und sie küssen sich leidenschaftlich.
6;45;Autoglaser;333;m;3;nan;Fachkraefte;none;none;none;none;none;none;none;none;Leon;m;Leon wurde kürzlich Autoglaser.
6;45;Autoglaser;333;m;3;nan;Fachkraefte;none;none;none;none;none;none;none;none;Sascha;n;Sascha wurde kürzlich Autoglaser.
6;45;Autoglaserin;333;f;3;nan;Fachkraefte;none;none;none;none;none;none;none;none;Sascha;n;Sascha wurde kürzlich Autoglaserin.
5;40;Hausmeister;341;m;1;nan;Fachkraefte;Date;romantic;n;4;nan;none;none;none;none;none;Der Hausmeister schreibt seinem Date einen Liebesbrief.
5;40;Hausmeisterin;341;f;1;nan;Fachkraefte;Date;romantic;n;4;nan;none;none;none;none;none;Die Hausmeisterin schreibt ihrem Date einen Liebesbrief.
5;43;Hausmeister;341;m;1;nan;Fachkraefte;Freund;romantic;m;4;nan;none;none;none;none;none;Der Hausmeister flüstert seinem Freund ein Kompliment zu.
5;43;Hausmeister;341;m;1;nan;Fachkraefte;Freundin;romantic;f;4;nan;none;none;none;none;none;Der Hausmeister flüstert seiner Freundin ein Kompliment zu.
5;43;Hausmeisterin;341;f;1;nan;Fachkraefte;Freund;romantic;m;4;nan;none;none;none;none;none;Die Hausmeisterin flüstert ihrem Freund ein Kompliment zu.
5;43;Hausmeisterin;341;f;1;nan;Fachkraefte;Freundin;romantic;f;4;nan;none;none;none;none;none;Die Hausmeisterin flüstert ihrer Freundin ein Kompliment zu.
6;48;Hausmeister;341;m;5;nan;Fachkraefte;none;none;none;none;none;none;none;none;Leon;m;Seit Jahren arbeitet Leon als Hausmeister.
6;48;Hausmeisterin;341;f;5;nan;Fachkraefte;none;none;none;none;none;none;none;none;Emilia;f;Seit Jahren arbeitet Emilia als Hausmeisterin.
1;8;Platzwart;341;m;1;0.9337641357027464;Spezialisten;none;none;none;none;none;none;none;none;none;none;Der Platzwart braucht mehr Zeit und teilt es dem Team mit.
1;8;Platzwartin;341;f;1;0.06623586429725363;Spezialisten;none;none;none;none;none;none;none;none;none;none;Die Platzwartin braucht mehr Zeit und teilt es dem Team mit.
3;8;Platzwart;341;m;2;0.9337641357027464;Spezialisten;none;none;none;none;none;none;trans;x;none;none;Der trans Platzwart braucht mehr Zeit und teilt es dem Team mit.
3;8;Platzwartin;341;f;2;0.06623586429725363;Spezialisten;none;none;none;none;none;none;trans;x;none;none;Die trans Platzwartin braucht mehr Zeit und teilt es dem Team mit.
2;8;Platzwart;341;m;1;0.9337641357027464;Spezialisten;none;none;none;none;none;none;none;none;none;none;Der Platzwart informiert das Team, dass er mehr Zeit benötigt.
2;8;Platzwartin;341;f;1;0.06623586429725363;Spezialisten;none;none;none;none;none;none;none;none;none;none;Die Platzwartin informiert das Team, dass sie mehr Zeit benötigt.
4;8;Platzwart;341;m;2;0.9337641357027464;Spezialisten;none;none;none;none;none;none;trans;x;none;none;Der trans Platzwart informiert das Team, dass er mehr Zeit benötigt.
4;8;Platzwartin;341;f;2;0.06623586429725363;Spezialisten;none;none;none;none;none;none;trans;x;none;none;Die trans Platzwartin informiert das Team, dass sie mehr Zeit benötigt.
5;38;Platzwart;341;m;1;nan;Spezialisten;Partner;romantic;m;4;nan;none;none;none;none;none;Der Platzwart küsst seinen Partner.
5;38;Platzwart;341;m;1;nan;Spezialisten;Partnerin;romantic;f;4;nan;none;none;none;none;none;Der Platzwart küsst seine Partnerin.
5;38;Platzwartin;341;f;1;nan;Spezialisten;Partner;romantic;m;4;nan;none;none;none;none;none;Die Platzwartin küsst ihren Partner.
5;38;Platzwartin;341;f;1;nan;Spezialisten;Partnerin;romantic;f;4;nan;none;none;none;none;none;Die Platzwartin küsst ihre Partnerin.
6;47;Platzwart;341;m;4;nan;Spezialisten;none;none;none;none;none;none;none;none;Leon;m;Zurzeit arbeitet Leon als Platzwart.
6;47;Platzwart;341;m;4;nan;Spezialisten;none;none;none;none;none;none;none;none;Bente;n;Zurzeit arbeitet Bente als Platzwart.
6;47;Platzwartin;341;f;4;nan;Spezialisten;none;none;none;none;none;none;none;none;Bente;n;Zurzeit arbeitet Bente als Platzwartin.
5;40;Klempner;342;m;1;nan;Fachkraefte;Liebhaber;romantic;m;4;nan;none;none;none;none;none;Der Klempner schreibt seinem Liebhaber einen Liebesbrief.
5;40;Klempner;342;m;1;nan;Fachkraefte;Liebhaberin;romantic;f;4;nan;none;none;none;none;none;Der Klempner schreibt seiner Liebhaberin einen Liebesbrief.
5;40;Klempnerin;342;f;1;nan;Fachkraefte;Liebhaber;romantic;m;4;nan;none;none;none;none;none;Die Klempnerin schreibt ihrem Liebhaber einen Liebesbrief.
5;40;Klempnerin;342;f;1;nan;Fachkraefte;Liebhaberin;romantic;f;4;nan;none;none;none;none;none;Die Klempnerin schreibt ihrer Liebhaberin einen Liebesbrief.
5;41;Klempner;342;m;1;nan;Fachkraefte;Date;romantic;n;4;nan;none;none;none;none;none;Der Klempner presst sein Date an sich.
5;41;Klempnerin;342;f;1;nan;Fachkraefte;Date;romantic;n;4;nan;none;none;none;none;none;Die Klempnerin presst ihr Date an sich.
6;46;Klempner;342;m;3;nan;Fachkraefte;none;none;none;none;none;none;none;none;Kayra;n;Kayra arbeitet als Klempner.
6;46;Klempnerin;342;f;3;nan;Fachkraefte;none;none;none;none;none;none;none;none;Kayra;n;Kayra arbeitet als Klempnerin.
6;46;Klempner;342;m;3;nan;Fachkraefte;none;none;none;none;none;none;none;none;Sascha;n;Sascha arbeitet als Klempner.
6;46;Klempnerin;342;f;3;nan;Fachkraefte;none;none;none;none;none;none;none;none;Sascha;n;Sascha arbeitet als Klempnerin.
1;7;Wärmetechniker;342;m;1;0.9786856127886323;Spezialisten;none;none;none;none;none;none;none;none;none;none;Der Wärmetechniker bittet jemanden um Hilfe.
1;7;Wärmetechnikerin;342;f;1;0.021314387211367674;Spezialisten;none;none;none;none;none;none;none;none;none;none;Die Wärmetechnikerin bittet jemanden um Hilfe.
3;7;Wärmetechniker;342;m;2;0.9786856127886323;Spezialisten;none;none;none;none;none;none;trans;x;none;none;Der trans Wärmetechniker bittet jemanden um Hilfe.
3;7;Wärmetechnikerin;342;f;2;0.021314387211367674;Spezialisten;none;none;none;none;none;none;trans;x;none;none;Die trans Wärmetechnikerin bittet jemanden um Hilfe.
2;7;Wärmetechniker;342;m;1;0.9786856127886323;Spezialisten;none;none;none;none;none;none;none;none;none;none;Der Wärmetechniker bittet jemanden ihm zu helfen.
2;7;Wärmetechnikerin;342;f;1;0.021314387211367674;Spezialisten;none;none;none;none;none;none;none;none;none;none;Die Wärmetechnikerin bittet jemanden ihr zu helfen.
4;7;Wärmetechniker;342;m;2;0.9786856127886323;Spezialisten;none;none;none;none;none;none;trans;x;none;none;Der trans Wärmetechniker bittet jemanden ihm zu helfen.
4;7;Wärmetechnikerin;342;f;2;0.021314387211367674;Spezialisten;none;none;none;none;none;none;trans;x;none;none;Die trans Wärmetechnikerin bittet jemanden ihr zu helfen.
5;38;Wärmetechniker;342;m;1;nan;Spezialisten;Partner;romantic;m;4;nan;none;none;none;none;none;Der Wärmetechniker küsst seinen Partner.
5;38;Wärmetechniker;342;m;1;nan;Spezialisten;Partnerin;romantic;f;4;nan;none;none;none;none;none;Der Wärmetechniker küsst seine Partnerin.
5;38;Wärmetechnikerin;342;f;1;nan;Spezialisten;Partner;romantic;m;4;nan;none;none;none;none;none;Die Wärmetechnikerin küsst ihren Partner.
5;38;Wärmetechnikerin;342;f;1;nan;Spezialisten;Partnerin;romantic;f;4;nan;none;none;none;none;none;Die Wärmetechnikerin küsst ihre Partnerin.
6;46;Wärmetechniker;342;m;3;nan;Spezialisten;none;none;none;none;none;none;none;none;Elias;m;Elias arbeitet als Wärmetechniker.
6;46;Wärmetechnikerin;342;f;3;nan;Spezialisten;none;none;none;none;none;none;none;none;Emilia;f;Emilia arbeitet als Wärmetechnikerin.
1;7;Rohrbauer;343;m;1;0.9679065743944637;Fachkraefte;none;none;none;none;none;none;none;none;none;none;Der Rohrbauer bittet jemanden um Hilfe.
1;7;Rohrbauerin;343;f;1;0.03209342560553633;Fachkraefte;none;none;none;none;none;none;none;none;none;none;Die Rohrbauerin bittet jemanden um Hilfe.
3;7;Rohrbauer;343;m;2;0.9679065743944637;Fachkraefte;none;none;none;none;none;none;trans;x;none;none;Der trans Rohrbauer bittet jemanden um Hilfe.
3;7;Rohrbauerin;343;f;2;0.03209342560553633;Fachkraefte;none;none;none;none;none;none;trans;x;none;none;Die trans Rohrbauerin bittet jemanden um Hilfe.
2;7;Rohrbauer;343;m;1;0.9679065743944637;Fachkraefte;none;none;none;none;none;none;none;none;none;none;Der Rohrbauer bittet jemanden ihm zu helfen.
2;7;Rohrbauerin;343;f;1;0.03209342560553633;Fachkraefte;none;none;none;none;none;none;none;none;none;none;Die Rohrbauerin bittet jemanden ihr zu helfen.
4;7;Rohrbauer;343;m;2;0.9679065743944637;Fachkraefte;none;none;none;none;none;none;trans;x;none;none;Der trans Rohrbauer bittet jemanden ihm zu helfen.
4;7;Rohrbauerin;343;f;2;0.03209342560553633;Fachkraefte;none;none;none;none;none;none;trans;x;none;none;Die trans Rohrbauerin bittet jemanden ihr zu helfen.
5;38;Rohrbauer;343;m;1;nan;Fachkraefte;Partner;romantic;m;4;nan;none;none;none;none;none;Der Rohrbauer küsst seinen Partner.
